,url,title,salary,company_name,company_verified,adress,employment_mode,experience,parttime,accept_temporary,description,creation-time,tag
205,https://nn.hh.ru/vacancy/48122932?from=vacancy_search_list&query=java%20junior,Senior C# разработчик (МТС Live),з/п не указана,ПАО «МТС» ,True,Москва,"Полная занятость, полный день",3–6 лет,False,False,"






Stream – дочерняя компания ПАО МТС, задача которой – вывести мобильную и веб-разработку холдинга на новый уровень. Мы строим экосистему МТС и создаем продукты, которые удовлетворяют повседневные потребности наших клиентов в таких сферах, как бизнес, финансы, коммуникации, медиа, развлечения, здоровье, автомобили и другие. В Stream работа построена на сплоченных продуктовых командах, работающих по agile методологиям. У нас не принят «шерринг» ресурсов и есть штатные скрам-мастера. Среди нас есть признанные эксперты в каждой компетенции, готовые прийти на помощь в сложной ситуации. На продукт ""MTS Live"" требуется Senior C# разработчик. МТС Live (http://live.mts.ru/) – это сервис по продаже билетов на мероприятия, личный помощник, который предлагает кино, концерты или шоу с учетом персональных интересов. Что предстоит делать:  Построение распределенного back-end в команде 4-10 инженеров Разработка высокоэффективного серверного кода Рецензирование кода младших коллег Участие в адаптации компонентов экосистемы МТС Участие в построении архитектуры модулей Следование соглашениям по разработке и принятой архитектуре Вывод и сопровождение (L3) продукта в Production  Мы ожидаем от тебя:  Опыт работы с платформой .NET от 5 лет (из которых минимум 2 года, как Middle) Опыт работы с Git (Git Flow / GitHub Flow / Trunk-based) Опыт работы в команде 3+ человек Уверенное знание языка C#, принципов разработки чистого кода и владение средствами отладки Уверенное знание платформ .NET Core 3.1 / NET 5 и ASP.NET Core Уверенное понимание принципов работы с CLR и GC Уверенное знание SQL и принципов моделирования хранилищ данных Опыт работы с паттерном REST Опыт работы с PostgreSQL 12 Опыт работы с Cassandra 4.x Опыт работы с Elasticsearch Опыт работы с RabbitMQ Опыт работы с Apache Kafka 2.5.x Опыт работы с Redis (минимум понимание Redlock)  Будет плюсом:  Опыт работы с платформой Java Опыт работы с протоколом gRPC (protobuf3) Опыт работы со спецификацией GraphQL (библиотека Hot Chocolate) Понимание TDD/DDD Понимание принципов работы Kubernetes (Docker) Понимание моделей ACID и BASE  Мы предлагаем:  Минимум легаси, highload оформление по ТК РФ ""белая"" заработная плата + полугодовые премии ДМС со стоматологией, страхование жизни компенсация мобильной связи обучение и посещение профильных конференций комфортный офисы с массажным креслом, настольным теннисом и прекрасным видом из окон (Москва, Санкт-Петербург, Казань, Пермь) или возможность дистанционной работы - все для вашего удобства и продуктивности  У нас есть большие планы по разработке принципиально новых приложений, и мы ждём в свою команду именно тебя!  






",Вакансия опубликована 21 сентября 2021 в Москве,"['Scrum', 'DDD', 'Agile Project Management', 'Atlassian Jira', 'Креативность']"
206,https://nn.hh.ru/vacancy/47360546?from=vacancy_search_list&query=java%20junior,"Middle Java Developer (команда разработки ""Транзакционных кредитных продуктов"")",з/п не указана,Сбер для экспертов,True,"Самара, Московское шоссе, 41","Полная занятость, полный день",1–3 года,False,False,"





Сплоченная и дружная команда разработки Транзакционных кредитных продуктов в связи с расширением ищет кандидатов на открытые вакансии. Мы предлагаем уникальный шанс участвовать в разработке нового банковского продукта, аналогов которому на сегодняшний день нет ни в России и за ее пределами. Если ты хочешь создать что-то новое, если ты готов к большой, но интересной работе, и слово «команда» для тебя – не пустой звук, тогда присылай нам свое резюме.Работа у нас - это отличный шанс присоединиться к команде профессионалов, отвечающей за разработку одного из самых сложных и динамичных продуктов Банка. Что нам важно:  хорошее знание Java SE; опыт работы со Spring Framework (в том числе MVC, Spring Data, Spring boot); знание JEE (JPA, JMS, Servlet); опыт работы с ORM (Hibernate / EclipseLink); опыт работы с базами данных (Oracle / PostgreSQL); опыт работы с системами сборки приложений (Maven / Gradle); опыт работы с JEE контейнерами; опыт работы с Git; понимание принципов парадигмы реактивного программирования (Spring WebFlux / Project Reactor / RxJava); понимание принципов микросервисной архитектуры; умение ставить задачу самому себе и младшим коллегам.  Дополнительными плюсами будет:  опыт работы с брокерами сообщений (Kafka/IBM WebSphere MQ); опыт работы с Docker, Kubernetes, OpenShift; опыт работы с Istio; понимание принципов DevOps.  Мы со своей стороны предлагаем:  технически сложные задачи; актуальный стек технологий и профессиональную команду; опыт разработки и внедрения реальных нагруженных и распределенных информационных систем, возможность сделать level - up в компетенциях и карьере.   




Преимущества работы в Сбере



Уникальные технологические и инновационные проекты



Команда экспертов и профессионалов своего дела



Развитие и обучение: своя digital-платформа для дистанционного обучения и развития ключевых ИТ-компетенций



Социальный пакет (ДМС, корпоративная пенсионная программа, материальная помощь)



Скидки для сотрудников от партнеров экосистемы Сбера



Свободный дресс-код




Делай мир лучше со Сбером






",Вакансия опубликована 20 сентября 2021 в Самаре,"['Java SE', 'Java', 'Spring']"
207,https://nn.hh.ru/vacancy/38996895?from=vacancy_search_list&query=java%20junior,Разработчик/Старший разработчик Java (SAP Cloud Platform),з/п не указана,MASTERDATA,True,Москва,"Полная занятость, полный день",1–3 года,False,False,"


















                Отличные условия для работы и развития


MASTERDATA – системный интегратор продуктов SAP, Pega и Salesforce, признанный лидер по внедрению современных бизнес-решений и информационных технологий для повышения эффективности бизнеса. Одно из наших направлений – внедрение омниканальных интернет-магазинов на e-commerce платформе Hybris.
            

 Наши офисы расположены в Москве, Киеве, Минске, Нью-Йорке, Париже, Риге и Торонто. В компании работает более 1200 сотрудников, 70% из которых – разработчики и бизнес-аналитики.              
            



Обязанности:  Проектирование, разработка, отладка и оптимизация программных модулей и решений на коммерческих проектах по SAP Cloud Platform, SAP Marketing, SAP S/4HANA. Подготовка и проведение функционального и интеграционного тестирования совместно с функциональными консультантами; Сопровождение развёртывания решений в продуктивную среду; Оперативный анализ проблем в продуктивной системе и их решение; Контроль качества разработок, выдача рекомендаций и оптимизация решений; Написание функциональных и технических спецификаций на разработки по функциональным и бизнес-требованиям; Проведение внутренних курсов и мастер-классов; Наставничество младших специалистов; Формирование базы знаний компании.  Требования:   Законченное высшее образование, в сфере ИТ  Jira, Confluence, HTTP, REST, OData Опыт коммерческой разработки Java 8+ (Spring) от 1 года;  Условия:  Интересные проекты, в том числе международные Добровольное медицинское страхование Корпоративный английский язык Оформление по ТК РФ Конкурентную и официальную ЗП Современный офис в 5 минутах ходьбы от метро Автозаводская Молодую и энергичную команду 






",Вакансия опубликована 20 сентября 2021 в Москве,"['Java', 'Spring Framework', 'scp', 'SAP']"
208,https://nn.hh.ru/vacancy/48069420?from=vacancy_search_list&query=java%20junior,JAVA Technical Lead with FinTech experience,до 7 500 USD на руки,КА Натальи Зотовой,True,Санкт-Петербург,"Полная занятость, удаленная работа",не требуется,False,False,"Вакансия открыта в латвийском офисе компании, работа может быть как удалённой так и с переездом в Ригу с зачислением в штат. Job description MeaPay is an international FinTech company developing solutions for mobile contactless payments acceptance. Our mission is to get rid of plastic POS terminals worldwide and replace them with off-the-shelf smartphones with the installed application we are building. This will help to democratize payment acceptance and lower the barrier to entry for merchants in selected business segments. Name of the company MeaWallet is a digital payments enabler. We help FinTechs, issuers, acquirers, and PSPs globally in enabling card tokenization, mobile contactless payment acceptance and related services, through our Mea Token Platform and MeaPay solutions. MeaWallet is a proud Mastercard Engage, Visa Ready and American Express GNS partner.   MeaWallet is a global company headquartered in Oslo (Norway). With employees residing in six countries and spanning more than 10 nationalities, we serve more than 100 customers in 30 countries. We are an organization with a mix of industry veterans combined with young, entrepreneurial spirits, that constantly challenges the status quo. This combination has proven to be unique and valuable, and has generated proven results with customers, partners and in the FinTech industry in general. Number of employees in the project 60+ Looking currently for a person who will be working with platform core project– New vacancy Name of the position JAVA Technical Lead with FinTech experience MeaPay is a product of the Norway-based MeaWallet, a center of excellence within mobile and digital payments and mobile wallets, providing state-of-the-art certified technology in 25 countries. Through the company’s close relationships with Amex, Mastercard, Visa and other key organizations, they are at the forefront of the mobile payments space. MeaPay is the latest technology to come out of the company’s Oslo and Riga locations, making it possible to sever the ties between expensive hardware and contactless payment – bringing device freedom to any merchant. Service offered to Banks and FinTechs Example: Swedbank mobile bank card payments are done with a help of MeaWallet solutions. This project field is called card tokenization.   Project Cycle Development of MeaPay project was started 01/2021. At the moment Project goes under certification and is in development phase. SDK app is already finished, but additional integrations are needed. Duties and responsibilities Technical leadership within a team to co-ordinate and deliver scalable, secure solutions in line with good industry software engineering practices (code quality, CI/CD, security etc). Working within a project management/kanban delivery methodology Experience of technical ownership for a product or software solution, covering design, estimation, shaping and user story/requirement creation Documentation of solutions (e.g. architecture, configuration, release, support-handover Able to simply and clearly communicate technical designs in conversation, documentation and presentations to stakeholders of various technical ability. Provide effective knowledge transfer to team members and customers. Manage, coach and develop junior members of your team and wider community Conduct system wide requirement analysis. Conduct module level work effort estimations and integrate for the whole system Will guide Team of Project Architecture and plan tools Participate in system or module development for the FinTech industry. Responsible for technology choice and when to add something to IT stack Update and improve existing functionality. IT stack Java 11, (will be migration to Java 17), Spring Boot microservices (potentially looking at Quarkus as well), AWS, PostgreSQL, Docker, Fargate (Kubernetes implementation within Amazon) , CI/CD, integration tests, API testing, Flutter, Vuejs, Messaging   Architecture   MVP/Flutter, Service-base architecture, Containers   Testing   Unit testing, CI/CD integration tests, API testing   The methodology by which work is organized (Agile, Scrum, KANBAN, Waterfall)   KANBAN (Weekly Deployment)   2 week sprints with startup environment release cycle (often)   Requirements   Work experience:   5+ /Talking about Senior level/Lead level role   Required IT stack (level/years)   Overall IT work experience at least 6/8+ years Must have experience working with project production maintenance. Must have experience in full project development cycle: Development, QA, Model, Production, Maintenance Must Have Spring Boot, Java 11 and testing experience. Deep understanding of coding best practices and modern architectural patterns, including microservices and architectures Hands-on developing / coding role using the following technologies: o Frontend not necessary o Backend (Java, Spring Boot, Hibernate, Quarkus) o Integration experience (JMS, ActiveMQ, Kafka, Amazon SQS) o DevOps (Docker, Kubernetes, Pipelines, SonarQube, AWS Fargate, Service Mesh) o API Design experience (REST, JSON, gRPC, HTTPs) o Data Processing experience not necessary o Architecture experience (Microservices, Cloud-native, Reactive, MVP) Level of languages   Spoken   Written   English   C1   Further recruitment process (interviews, tests)   MateHR interview – Tech inteeview – Tech task – Offer        ",Вакансия опубликована 19 сентября 2021 в Санкт-Петербурге,"['Английский\xa0— C1 — Продвинутый', 'Hibernate ORM', 'Git', 'Spring Framework', 'Java', 'Английский язык']"
209,https://nn.hh.ru/vacancy/47078269?from=vacancy_search_list&query=java%20junior,Junior разработчик PHP/ PHP Developer,до 100 000 руб. до вычета налогов,FM Logistic,True,Москва,"Полная занятость, полный день",1–3 года,False,False,"








FM Logistic - международная компания, один из лидеров российского логистического рынка, предоставляющая полный комплекс услуг по 
управлению цепочкой поставок, таких как складирование, перевозки всеми видами транспорта, упаковка и расфасовка, таможенное оформление.
Профессиональные навыки - Опыт в программировании от 0,5 года - Самостоятельность в выполнении задач - Знания по стеку технологий - Разработка программного кода модулей/межмодульные взаимодействия - Планирование тестов и тестовых наборов - Работа с проектной документацией - Участие в рефакторинге кода;   Профессиональные знания/умения: Опыт работы с 3мя или более технологиями: Back - PHP, Node.js, Python, Java, Front - Javascript, React, HTML5, CSS3 DB - Oracle, MySQL, Elastic, MongoDB Environment - Docker, Git, Linux, npm   Плюсом будет : - понимание технологий интеграции данных ESB и ETL; - опыт в установке ПО и его дальнейшая отладка для работы веб-приложения; - умение Покрывать свой код тестами - Английский язык - intermediate level и выше.   Место работы:  Хлебниково (D1), Долгопрудный, Новое шоссе 34 чтр 4 Корпоративный транспорт: Войковская, Речной вокзал, Планерная, Химки Питание, ДМС, Спорт      










",Вакансия опубликована 20 сентября 2021 в Москве,"['Английский\xa0— A2 — Элементарный', 'JavaScript', 'MongoDB', 'Python', 'MySQL', 'Node.js']"
210,https://nn.hh.ru/vacancy/41837109?from=vacancy_search_list&query=java%20junior,QA Automation Engineer-Trainee (Software Developer in Test ),з/п не указана,Godel Technologies Europe,True,Могилев,"Полная занятость, полный день",не требуется,False,False,"Могилевский офис английской компании Godel Technologies Europe приглашает на оплачиваемую стажировку людей, готовых учиться и развиваться в качестве QA Automation Engineer (Software Developer in Test)! Мы – IT компания, главным богатством которой являются наши сотрудники - умные и талантливые специалисты, которые стремятся делать вещи правильно. Наши клиенты - английские компании, крупные и известные не только на территории UK, но и всего мира. Центры разработки расположены в Беларуси, Украине, Болгарии, Польше и Литве и на сегодняшний день это: Минск, Брест, Могилёв, Гомель , Гродно и Витебск, Лодзь, Вроцлав, Вильнюс, Киев и София.   Наши QA Automation Engineer работают на проектах с тем, в чём сильны и что считают оптимальным. Что для нас важно? - - Знание/понимание/владение принципами ООП - Образование/Курсы QA+A-QA - Языки программирования: С# , Java   Большим плюсом будет владение английским языком уровня B1 и выше.   В нашей команде в Могилеве сейчас более 70 сотрудников и мы будем рады новым коллегам, которые готовы профессионально расти и развиваться вместе с нами. Нам действительно ценна наша команда, поэтому важно, чтобы вы: • были ответственны за результаты своей работы и свой продукт; • для вас немаловажно с кем вы работаете, вы готовы тесно сотрудничать с вашей командой и командой клиента; • вы имеете свою точку зрения и готовы ею делиться.   Мы готовы вам предложить: • оплачиваемую стажировку; • возможность попасть в команду после успешного прохождения программы в качестве Junior QA Automation Engineer; • социальный пакет, включающий медицинскую страховку, оплату спортивных занятий, уроки английского языка и пр.; • 28 календарных дней отпуска, выходной в ваш День Рождения; • гибкий график, возможность при необходимости работать вне офиса; • насыщенную корпоративную культуру, начиная от офисных соревнований по кикеру и теннису до больших ярких вечеринок и корпоративных поездок в другие страны мира; • возможность командировок в Великобританию; • команду равных, готовую учиться и обучать.",Вакансия опубликована 19 сентября 2021 в Могилеве,"['Английский\xa0— B1 — Средний', 'Java', 'ООП', 'Java SE', 'SQL', 'Английский — B1 — Средний', 'Automation testing', 'AQA']"
