,url,title,salary,company_name,company_verified,adress,employment_mode,experience,parttime,accept_temporary,description,creation-time,tag
79,https://nn.hh.ru/vacancy/47848731?from=vacancy_search_list&query=java%20junior,"Java, Hybris, microservices разработчик удалённо",з/п не указана,ИП Гаврыш Г. А.,True,Минск,"Частичная занятость, удаленная работа",1–3 года,False,"Возможно временное оформление: договор услуг, подряда, ГПХ, самозанятые, ИП","Предлагаем удаленную работу. ЗП в зависимости от квалификации и опыта. В первую очередь рассматриваем старшего разработчика.  Требования и навыки: - Java 8+ - microservices - VUE js (желательно, высокий приоритет) - SAP Commerce, Hybris (опционально, при необходимости обучим) - Spring Большой опыт в других технологиях, тоже рассмотрим. Оплата на счёт ИП или самозанятого. Старшему разработчику возможна работа на частичную занятость. Однако преимущество отдаём полной занятости. Просим выслать резюме, указать общий опыт разработки в ИТ, сколько часов в день имеете возможность работать. Junior разработчику можем предложить платное обучение. 200 RUB акад. час в нашей группе.   ",Вакансия опубликована 10 сентября 2021 в Минске,"['Spring Framework', 'Apache Maven', 'Git', 'Java', 'SQL', 'Hybris', 'JPA', 'microservices', 'AWS']"
80,https://nn.hh.ru/vacancy/48107841?from=vacancy_search_list&query=java%20junior,Junior Java Developer,от 90 000 до 140 000 руб. на руки,INTECH,True,Москва,"Полная занятость, удаленная работа",1–3 года,False,False,"ГК ИНТЕК - IT-компания, разработчик дополнительных сервисов и услуг для сотовых операторов на рынке России и стран СНГ. Мы активно внедряем продукты на базе голоса, стриминговые музыкальные порталы, системы машинного обучения поведения пользователей, cashback, виртуальные АТС, туристические сервисы и т.д. В личном кабинете своего сотового оператора вы точно найдете сервисы, которые разрабатывала наша компания. В настоящий момент мы ищем в свою команду Junior Java разработчика (направление интернет-решений) Чем предстоит заниматься:    Разрабатывать компоненты и системы для новых проектов;   Сопровождать существующие продукты (докручиваем новые фичи, обновляем версии сервисов и т.д.);   Проводить code review;   Взаимодействовать с проектной командой.     Для работы потребуется:   Опыт коммерческой разработки не менее 6 месяцев;   Java core ООП: работаю по SOLID, применяю базовые паттерны;   Java collection: знаю базовые, для свободной работы хватает;   Многопоточность: могу запараллелить обработку очереди в несколько потоков;   Spring (web, mvc, security): сайты делать я могу;   Hibernate/SQL: любой запрос за пол часа;   Навыки работы с JUnit – знаю, видел, применял;   Опыт работы с ОС Linux на уровне продвинутого пользователя;   Опыт работы с системами контроля версий;   Желание учиться и развивать свой технологический бэкграунд.     Мы предлагаем:   Работу в офисе, на удаленке или гибридный график (хотите сменить обстановку? Для вас всегда найдется место в офисе(г. Нижний Новгород или Москва);   Комфортный график работы – с 9.00 до 17.00 или 10.00 до 18.00, включая перерыв на обед;   Отсутствие огромного количества переработок и работы в выходные дни. Мы ценим личное пространство наших сотрудников и стремимся соблюдать work-life balance;   Официальное трудоустройство и заработную плату – обсуждаем индивидуально с каждым кандидатом, все зависит от вашей квалификации и опыта;   Отсутствие бюрократии и работы «в стол».   Интересные задачи, возможность предлагать и реализовывать собственные идеи;   Возможность профессионального роста и самореализации;   Адекватное руководство.   А также:   Гибкая мотивационная система;   Премии по итогам запуска проектов;   Обучение;   Ежегодные корпоративные мероприятия.  ",Вакансия опубликована 2 октября 2021 в Москве,[]
81,https://nn.hh.ru/vacancy/47893804?from=vacancy_search_list&query=java%20junior,Junior Java-разработчик,до 100 000 руб. на руки,AISA,True,"Санкт-Петербург, Чернышевская","Полная занятость, полный день",не требуется,False,False,"Мы предлагаем:  Обучение построению и использованию облачной архитектуры с использованием kubernates (rke, k8s, k3s) на реальных внедрениях; Возможность поработать с огромными массивами данных (более 60 миллиардов сущностей) и изучить на практике современные инструменты их обработки (kafka, elasticsearch, mongodb и т.п.); Прокачка технических навыков на боевых задачах; Тренинги и мастер-классы без отрыва от основной деятельности; Система обучения и развития для сотрудников, которые только начинают свою карьеру; Гибкий рабочий график; Конкурентная заработная плата, готовы рассматривать Ваши пожелания; Бесплатные курсы английского языка для сотрудников; Официальное оформление по ТК: отпуска, больничные, белая заработная плата.  Обязанности:  Работать над реальными задачами; Учиться лучшим практикам кода; Развиваться в Java разработке, используя все доступные каналы информации.  Нам важно:   Опыт написания SQL запросов и знаком с реляционными базами данных (PostgreSQL, MySQL); Навыками разработки на Java; Опыт работы со Spring Boot, JPA, Spring Data.  Будет плюсом:  Наличие своего pet project на GitHub. ",Вакансия опубликована 1 октября 2021 в Санкт-Петербурге,"['MySQL', 'Java', 'PostgreSQL', 'Spring Boot', 'JPA']"
82,https://nn.hh.ru/vacancy/45725066?from=vacancy_search_list&query=java%20junior,Junior Java Developer (EI),от 90 000 руб. на руки,ООО Айфьючер,True,"Старая Деревня, Санкт-Петербург, Липовая аллея, 9а","Полная занятость, удаленная работа",1–3 года,False,False,"Наша компания - разработчик распределенного высоконагруженного софта в сфере спортивной аналитики ищет к себе в команду людей, желающих работать с узкоспециализированным highload продуктом, заниматься технически-сложными и интересными задачами, готовых вносить свои идеи в развитие продукта, обмениваться опытом с коллегами. В компании много развивающихся проектов, и в каждый из них мы ищем разработчиков. Стек: Java 8\11, Spring Framework 4, Spring Boot 2, PostgreSQL, Oracle, Apache Kafka, RabbitMQ, Hazelcast, RESTful API, gRPC, Unit-тесты (Junit, Mockito), Atlassian, Git-репозиторий, Bitbucket, Bamboo, Maven\Gradle, микросервисная архитектура. Проект связан с подключением к внешним источникам, сбором, обработкой полученных данных и встраиванием этих данных в нашу систему для дальнейшего использования. У Вас будет возможность:  участвовать в решении интересных, нетривиальных задач; реализовывать сложную бизнес логику, покрывая ее юнит-тестами; обмениваться знаниями с коллегами посредством code review и анализа задач; получить ценный опыт сопровождения большого высоконагруженного продукта в production среде.  Вы нам подходите, если:  участвовали в коммерческой разработке ПО от 0,5 года; обладаете базовыми знаниями Java (Collections, Concurrency, Generics, Exceptions, I/O и т.д.); обладаете базовыми знаниями Spring Framework (Core, AOP, JDBC + Transaction, Test); обладаете базовыми знаниями SQL; знакомы с системами контроля версий;  Дополнительно приветствуются:  навыки работы с *nix системами на уровне пользователя.  Условия:  заработная плата обсуждается по итогам собеседования; оформление по ТК РФ с первого рабочего дня; корпоративный ДМС + стоматология; компенация спорта; занятия английским языком с нашим преподавателем 2 раза в неделю; оплата профильного обучения (курсы, конференции, вэбинары, учебники и пр.); преимущественно удаленная работа, гибкий график, присутственные часы с 11 до 17. ",Вакансия опубликована 1 октября 2021 в Санкт-Петербурге,[]
83,https://nn.hh.ru/vacancy/48258387?from=vacancy_search_list&query=java%20junior,Junior java-разработчик,от 15 000 руб. на руки,Request Code,True,Минск,"Полная занятость, удаленная работа",не требуется,False,False,"Обязанности:  Разрабатывать компоненты и системы для новых проектов; Сопровождать существующие продукты ; Проводить code review; Взаимодействовать с проектной командой;  Требования:  С компьютером на ""ты""; Базовые знания программирования на уровне третьего курса института; Базовые знания java/kotlin, опыт программирования на java/kotlin для себя или в целях обучения; Базовые знания Spring Framework; SQL; Умение понимать технический текст на английском (для чтения документации по java/kotlin/spring);  Условия:  Первые 3 месяца стажировка со стипендией 15 к, Затем оклад 30к Удаленный формат работы; Интересные задачи. ",Вакансия опубликована 1 октября 2021 в Минске,"['Java', 'SQL', 'Английский язык', 'Java SE', 'Driving Licence B']"
84,https://nn.hh.ru/vacancy/48101060?from=vacancy_search_list&query=java%20junior,"JavaScript разработчик (Junior, Middle или Senior)",до 2 500 USD на руки,Zeroqode,True,Киев,"Полная занятость, удаленная работа",не требуется,False,False,В компанию Zeroqode (zeroqode.com) - один из мировых лидеров no-code - требуются JavaScript разработчики на полную занятость для создания плагинов к платформе Bubble. ПРЕИМУЩЕСТВА:- Удаленная работа с гибким графиком- Конкурентная почасовая оплата со стабильным объемом задач- Квартальные бонусы на базе KPI- Отличная команда - наставничество и передача знаний от опытных разработчиков- Возможность реализовать свой творческий потенциал ТРЕБОВАНИЯ:- Базовый (и выше) уровень понимания java script- Базовый опыт в веб разработке. Заинтересованных кандидатов просьба присылать свою заявку сюда: zeroqode.com/jobs     ,Вакансия опубликована 2 октября 2021 в Киеве,"['JavaScript', 'Творческое мышление', 'Java Script', 'Опытный пользователь ПК', 'Удаленная работа', 'AngularJS', 'CSS', 'Node.js', 'C++']"
85,https://nn.hh.ru/vacancy/47892013?from=vacancy_search_list&query=java%20junior,Junior Java-разработчик,до 100 000 руб. на руки,AISA,True,"Москва, Кантемировская","Полная занятость, полный день",1–3 года,False,False,"Мы предлагаем:  Обучение построению и использованию облачной архитектуры с использованием kubernates (rke, k8s, k3s) на реальных внедрениях; Возможность поработать с огромными массивами данных (более 60 миллиардов сущностей) и изучить на практике современные инструменты их обработки (kafka, elasticsearch, mongodb и т.п.); Прокачка технических навыков на боевых задачах; Тренинги и мастер-классы без отрыва от основной деятельности; Система обучения и развития для сотрудников, которые только начинают свою карьеру; Гибкий рабочий график; Конкурентная заработная плата, готовы рассматривать Ваши пожелания; Бесплатные курсы английского языка для сотрудников; Официальное оформление по ТК: отпуска, больничные, белая заработная плата.  Обязанности:  Работать над реальными задачами; Учиться лучшим практикам кода; Развиваться в Java разработке, используя все доступные каналы информации.  Нам важно:   Опыт написания SQL запросов и знаком с реляционными базами данных (PostgreSQL, MySQL); Навыками разработки на Java; Опыт работы со Spring Boot, JPA, Spring Data.  Будет плюсом:  Наличие своего pet project на GitHub. ",Вакансия опубликована 1 октября 2021 в Москве,"['MySQL', 'Java', 'PostgreSQL', 'Spring Boot', 'JPA']"
86,https://nn.hh.ru/vacancy/48369288?from=vacancy_search_list&query=java%20junior,Junior java разработчик,от 74 000 до 123 000 руб. на руки,Petshopru,True,Москва,"Полная занятость, полный день",1–3 года,False,False,"Привет, меня зовут Роман Ивлиев, я предлагаю тебе присоединиться к ИТ-команде Petshopru. Забегая вперёд скажу - вдумчиво прочитать всё описание вакансии у тебя займёт примерно 70 секунд (я замерял:)), удели их мне пожалуйста:) Petshopru - это не просто интернет-магазин №1 в сфере товаров для животных, но и активно развивающаяся IT-экосистема. Мы нацелились автоматизировать все сферы, связанные с комфортным существованием домашних питомцев. Сейчас ИТ-команда - это 60 инженеров, которые делают сайты, CRM-систему, умеют в Devops и автотесты. Есть свой продуктовый офис и проджект - менеджеры, которые максимально замыкают взаимодействие с бизнесом на себя, дабы разработка могла разрабатывать, а тестирование тестировать. Работы много, но мы готовы принять в коллектив младшего разработчика на Java, ****помочь ему расти и развиваться. В конце ты найдёшь формальные требования и условия сотрудничества, а пока я немного расскажу про нас - Petshopru - проект с 10-ти летней историей и, само собой, накопил определённый багаж кода и функционала, часть из которого как раз и придумали исправить, сделать более современным и качественным. Другими словами у тебя есть возможность принять участие в грандиозном проекте. В нашем коллективе есть старшие товарищи, которые с радостью поделятся с тобой опытом и помогут в решении рабочих вопросов. Ты будешь решать реальные задачи и видеть результаты своей работы в production. **** Подведу итоги: мы ищем надёжного товарища с горящими глазами, возможно, ещё не очень опытного, но готового много работать, учиться, расти, не чураться рутины и обязательно привнести в нашу добрую команду кусочек чего-то важного, что сделает её ещё более крутой. Если вдруг тебе эта вакансия показалась не очень привлекательной, с радостью отвечу на все вопросы, вдруг есть что-то, что для тебя важно, а я не написал. Ну и не забывай, что у тебя есть друзья и знакомые, которых может заинтересовать наше предложение, поделись пожалуйста ссылкой - плюс в карму обеспечен. Та самая формальная часть Мы ждем, что ты:  уже программируешь на Java от 0.5 года и реализовал что-то своими руками; встречался с Spring-фреймворком; имеешь понимание, как можно работать с базами данных при помощи SQL-запросов; представляешь, как выглядит JS-код или готов с ним познакомиться; понимаешь, что такое ООП, и какие задачи с его помощью можно решать.  Для твоей продуктивной работы у нас:  оформление по ТК РФ стабильные выплаты от 74 000 до 123 000 на руки (оклад от 60 000 до 100 000 два раза в месяц + квартальная премия в размере 70% от ежемесячного оклада); гибкий график начала рабочего дня; удаленный формат работы; митапы, курсы и всесторонняя поддержка в росте и развитии.   ",Вакансия опубликована 29 сентября 2021 в Москве,"['Java', 'SQL', 'Git', 'Spring Framework']"
