,url,title,salary,company_name,company_verified,adress,employment_mode,experience,parttime,accept_temporary,description,creation-time,tag
83,https://nn.hh.ru/vacancy/48101204?from=vacancy_search_list&query=lua,Go-разработчик (B2B Календарь),з/п не указана,"Mail.ru Group, Другое",True,Москва,"Полная занятость, полный день",3–6 лет,False,False,"





Почта Mail.ru
Крупнейший русскоязычный сервис бесплатной электронной почты. Наши особенности — неограниченный объем ящика, возможность пересылки аттачей до 20 ГБ, защита от вирусов и спама, темы для оформления интерфейса и писем и многое другое. Наша ежемесячная аудитория — 43,3 млн пользователей, входит в топ-5 мировых почтовых сервисов по дневной аудитории.
Для 100 миллионов активных аккаунтов умная, полезная и безопасная Почта Mail.ru стала центром цифровой жизни — пользователи не только ведут переписку, но и оплачивают штрафы, пополняют баланс телефона, переводят деньги. Команда машинного обучения и разработки делает Почту умнее с каждым днем — мы защищаем пользователей от спама, сортируем письма по категориям, выделяем важные и скрываем ненужные сообщения, предугадываем, что пользователь хочет написать, и предлагаем готовый текст ответа.



Мы ищем разработчика в команду разработки B2B Календаря. Мы строим экосистемный Календарь. Наша цель ― объединить все календари всех проектов компании в одном сервисе и предоставить нашим пользователям единый интерфейс планирования. Основные задачи B2B Календаря связаны с удовлетворением потребностей корпоративных пользователей ― а это значит, что ты будешь пользоваться сервисом, который разрабатываешь. Помимо продуктовых задач, у нас есть задачи по оптимизации производительности и проектированию микросервисов. Используемый стек технологий: Go, Python. Плюсы работы в нашей команде:  интересные и сложные задачи, разработка высоконагруженных сервисов; возможность самому пользоваться результатами своей работы; команда профессионалов, которые берут на себя ответственность за качество своей работы; возможность выбирать инструменты и технологии разработки.  Что нужно делать:  проектировать архитектуру и разрабатывать масштабируемые сервисы; разрабатывать функциональность календаря; оптимизировать систему хранения данных.  Требования:  опыт разработки на Go ― от 2 лет; знание Linux; опыт работы с SQL и NoSQL хранилищами; знание и понимание принципов работы web-сервисов.  Плюсом будет:  знание Lua; опыт работы с Kubernetes.  Желательно:  владение любым скриптовым языком (мы используем Lua и Python); работа с асинхронным IO (libevent, epoll, boost::asio); знание сетевых протоколов (особенно HTTP, SMTP и TCP/UDP); опыт работы с базами данных (РСУБД, NoSQL, In-memory); опыт разработки высоконагруженных/масштабируемых/отказоустойчивых систем.  Работа в Mail.ru Group ― это:  проекты большого масштаба: соцсети, почтовые сервисы, киберспорт, портал, игры, электронная коммерция ― в каждом есть возможность делать жизнь миллионов людей лучше; сложные и интересные задачи: высоконагруженные сервисы, которые задают уровень для конкурентов качеством и технологиями; быстрый рост в трендовых направлениях; амбициозные цели перед каждым проектом; оборудование: мощное железо, дополнительные мониторы, специализированные гаджеты ― все для решения масштабных задач и экспериментов; команда: работа бок о бок со «звездами» IT-индустрии, каждый из которых может поделиться своей экспертизой; профессиональное развитие: прямо в офисе мы организуем митапы, конференции, встречи разработчиков и тестировщиков, семинары и тренинги, куда открыт доступ каждому сотруднику; новый опыт: лучшие сотрудники преподают в наших образовательных проектах, выступают на российских и международных конференциях; офис в 5 минутах от метро, крытый паркинг для всех сотрудников, велопарковка, а летом ― прокат велосипедов, лонгбордов и самокатов; здоровье и спорт: программа ДМС доступна с первого месяца работы; для поддержания иммунитета круглый год во фреш-баре овощи и фрукты; собственный тренажерный и спортивный зал в офисе. 





",Вакансия опубликована 20 сентября 2021 в Москве,"['Golang', 'Go', 'Linux', 'SQL', 'Python']"
84,https://nn.hh.ru/vacancy/48076934?from=vacancy_search_list&query=lua,"Senior Programmer, Game (C++)/Ведущий программист C++",з/п не указана,Playrix,True,Санкт-Петербург,"Полная занятость, удаленная работа",3–6 лет,False,False,"








Playrix — крупнейшая игровая компания в СНГ. Мы входим в топ-3 самых успешных мобильных издателей в мире по доходам по версии App Annie на сентябрь 2020. В наши проекты ежемесячно играют более 130 миллионов человек.













Возможность работать удаленно или в одном из наших офисов.


Мы ищем увлеченного программиста для разработки мобильных игр с многомиллионной аудиторией. Мы разрабатываем игры на своём движке (аналог Unity), используем C++17, и у нас всегда есть интересные задачи для специалистов любого уровня. Для программистов без опыта GameDev мы разработали Bootcamp: возможность познакомиться с нашими технологиями и разработкой игр через выполнение учебного проекта под руководством опытного наставника. Задачи:  проектирование и ревью архитектуры фич; программирование игровых механик и логики; менторство, Code Review; профилирование и оптимизация игры по памяти и fps; разработка инструментов (редакторов, утилит и средств автоматизации); помощь команде в сложных технических задачах.  Требования:  опыт разработки на С++ от 5-ти лет; знание специфики игровой разработки, типовых паттернов; знание современных стандартов С++ 11/14/17, STL; умение проектировать архитектуру, самостоятельно реализовывать игровые механики и/или движковые подсистемы; знание технического английского языка.  Будет здорово, если вы:  имеете опыт мобильной разработки; имеете опыт работы с компьютерной графикой, опыт разработки на Python, Lua или других скриптовых языках.   


Что мы предлагаем?


Корпоративные бонусыКомпенсация английского, фитнеса, психолога и другие бонусы


Мероприятия и другие развлеченияМы регулярно проводим вечеринки, конференции и хакатоны


18 современных офисовВ России, Украине, Армении, Казахстане, Беларуси и Ирландии


Бесплатное питание в офисеСовременные кухня и кафе с трехразовым питанием и снеками


Комфортное рабочее местоРаботайте там, где вам удобно, — мы предоставим всю нужную технику


Забота о здоровье сотрудниковДМС для сотрудников и их детей и 100% компенсация больничного













",Вакансия опубликована 20 сентября 2021 в Санкт-Петербурге,"['C++', 'ООП', 'Game Programming']"
85,https://nn.hh.ru/vacancy/48070392?from=vacancy_search_list&query=lua,Ruby разработчик,з/п не указана,Сбер. IT,True,Москва,"Полная занятость, полный день",не требуется,False,False,"





Команда занимается созданием и продвижением универсальной платформы для продажи активов и поиска инвесторов. Сервис дает возможность купить или продать реальные крупные активы — от коммерческой недвижимости и производственных предприятий до частных домов и квартир.  Мы работаем на платформе Ruby/Ruby on Rails, используем современный стек (никакого легаси!) и ориентируемся на динамичное развитие сервиса. Задачи:разработка кодапроведение ревью/оптимизация кода других разработчиковвзаимодействие с аналитиками и бизнес заказчиками по бизнес-требованиямвзаимодействие с разработчиками UI. Требования:высшее образование (желательно техническое)отличное владение Ruby/Ruby on Railsвладение JavaScript и один любой из актуальных фреймворковпонимание устройства и работы различных типов БДумение писать код под высоконагруженные сервисы и разбираться в чужом кодеумение четко формулировать технологическую задачу партнерам по команденаписание тестов. Желательные знания и навыки:опыт работы с ELKопыт работы с RabbitMQ, Kafkaзадачи на Python, Lua или Elixir. Мы предлагаем возможность работать в самой стабильной и инновационной организации России, трудоустройство согласно ТК РФ, регулярное корпоративное обучение, большое количество различных митапов и хакатонов, ДМС, страхование от несчастных случаев, доступ в корпоративную библиотеку и тренажерные залы, широкий спектр дисконт–программ, скидок и привилегий от партнеров.И конечно же, яркую и насыщенную корпоративную жизнь.




Атмосфера



















Преимущества работы в Сбере



Уникальные технологические и инновационные проекты



Команда экспертов и профессионалов своего дела



Развитие и обучение: своя digital-платформа для дистанционного обучения и развития ключевых ИТ-компетенций



Социальный пакет (ДМС, корпоративная пенсионная программа, материальная помощь)



Скидки для сотрудников от партнеров экосистемы Сбера



Свободный дресс-код




Делай мир лучше со Сбером






",Вакансия опубликована 19 сентября 2021 в Москве,[]
86,https://nn.hh.ru/vacancy/47359572?from=vacancy_search_list&query=lua,Go-разработчик (B2B Календарь),з/п не указана,"Mail.ru Group, Почтовые сервисы",True,Москва,"Полная занятость, полный день",3–6 лет,False,False,"





Почта Mail.ru
Крупнейший русскоязычный сервис бесплатной электронной почты. Наши особенности — неограниченный объем ящика, возможность пересылки аттачей до 20 ГБ, защита от вирусов и спама, темы для оформления интерфейса и писем и многое другое. Наша ежемесячная аудитория — 43,3 млн пользователей, входит в топ-5 мировых почтовых сервисов по дневной аудитории.
Для 100 миллионов активных аккаунтов умная, полезная и безопасная Почта Mail.ru стала центром цифровой жизни — пользователи не только ведут переписку, но и оплачивают штрафы, пополняют баланс телефона, переводят деньги. Команда машинного обучения и разработки делает Почту умнее с каждым днем — мы защищаем пользователей от спама, сортируем письма по категориям, выделяем важные и скрываем ненужные сообщения, предугадываем, что пользователь хочет написать, и предлагаем готовый текст ответа.



Мы ищем разработчика в команду разработки B2B Календаря. Мы строим экосистемный Календарь. Наша цель ― объединить все календари всех проектов компании в одном сервисе и предоставить нашим пользователям единый интерфейс планирования. Основные задачи B2B Календаря связаны с удовлетворением потребностей корпоративных пользователей, а это значит, что ты будешь пользоваться сервисом, который разрабатываешь. Помимо продуктовых задач, у нас есть задачи по оптимизации производительности и проектированию микросервисов. Используемый стек технологий: Go, Python. Плюсы работы в нашей команде:  интересные и сложные задачи, разработка высоконагруженных сервисов; возможность самому пользоваться результатами своей работы; команда профессионалов, которые берут на себя ответственность за качество своей работы; возможность выбирать инструменты и технологии разработки.  Что нужно делать:  проектировать архитектуру и разрабатывать масштабируемые сервисы; разрабатывать функциональность Календаря; оптимизировать систему хранения данных.  Требования:  опыт разработки на Go ― от 2 лет; знание Linux; опыт работы с SQL и NoSQL хранилищами; знание и понимание принципов работы web-сервисов.  Плюсом будет:  знание Lua; опыт работы с Kubernetes.  Желательно:  владение любым скриптовым языком (мы используем Lua и Python); работа с асинхронным IO (libevent, epoll, boost::asio); знание сетевых протоколов (особенно HTTP, SMTP и TCP/UDP); опыт работы с базами данных (РСУБД, NoSQL, In-memory); опыт разработки высоконагруженных/масштабируемых/отказоустойчивых систем.  Работа в Mail.ru Group ― это:  проекты большого масштаба: соцсети, почтовые сервисы, киберспорт, портал, игры, электронная коммерция ― в каждом есть возможность делать жизнь миллионов людей лучше; сложные и интересные задачи: высоконагруженные сервисы, которые задают уровень для конкурентов качеством и технологиями; быстрый рост в трендовых направлениях; амбициозные цели перед каждым проектом; оборудование: мощное железо, дополнительные мониторы, специализированные гаджеты ― все для решения масштабных задач и экспериментов; команда: работа бок о бок со «звездами» IT-индустрии, каждый из которых может поделиться своей экспертизой; профессиональное развитие: прямо в офисе мы организуем митапы, конференции, встречи разработчиков и тестировщиков, семинары и тренинги, куда открыт доступ каждому сотруднику; новый опыт: лучшие сотрудники преподают в наших образовательных проектах, выступают на российских и международных конференциях; офис в 5 минутах от метро, крытый паркинг для всех сотрудников, велопарковка, а летом ― прокат велосипедов, лонгбордов и самокатов; здоровье и спорт: программа ДМС доступна с первого месяца работы; для поддержания иммунитета круглый год во фреш-баре овощи и фрукты; собственный тренажерный и спортивный зал в офисе. 





",Вакансия опубликована 20 сентября 2021 в Москве,"['Golang', 'Go', 'Linux', 'SQL', 'Python']"
