,url,title,salary,company_name,company_verified,adress,employment_mode,experience,parttime,accept_temporary,description,creation-time,tag
0,https://nn.hh.ru/vacancy/50754284?from=vacancy_search_list&query=lua&hhtmFrom=vacancy_search_list,Программист C/С++,False,ООО Скайтех,False,"Площадь Александра Невского 1, Санкт-Петербург, улица Профессора Качалова, 7","Полная занятость, полный день",1–3 года,False,False,"Скай Технолоджис - динамично развивающаяся российская компания - поставщик программного обеспечения для POS терминалов и технологический интегратор в сфере платежных технологий. Мы постоянно растем, развиваемся и сейчас в нашу дружную команду требуется разработчик C++. Если Вы активный, интересуетесь новыми технологиями, готовы решать сложные и интересные задачи, то будем рады знакомству!   Чем предстоит заниматься:  Разработка кроссплатформенного ПО для POS терминалов, Поддержка и улучшение существующего кода, Участие в разработке внутренних и заказных проектов; Работа в офисе полный рабочий день.    Здорово, если наши требования Вас не испугают:  Уверенное знание C99/C++03, STL, Понимание основных паттернов проектирования, Опыт разработки под Linux, владение сmake, gcc, bash, Опыт использования GIT, JIRA, Умение оценивать задачи и укладываться в сроки, Горящие глаза и желание сделать качественный продукт.    Дополнительные плюсы, которым мы будем очень рады:  Знание С++11/17, Опыт использования boost, Знание языков программирования LUA, Python, Знание BerTLV, EMV, PCI/PA, Опыт многопоточного программирования.    Что мы можем предложить:  Стабильная заработная плата, оформление в соответствии с ТК; Лояльность и отсутствие бюрократии; Карьерный и профессиональный рост; Испытательный срок 3 месяца. ",2022-01-22,['C/C++']
1,https://nn.hh.ru/vacancy/48730349?from=vacancy_search_list&query=lua&hhtmFrom=vacancy_search_list,Инженер по тестированию аппаратных платформ и ПО,False,СКАУТ Разработчик Системы,False,"Лесная, Чёрная речка, Санкт-Петербург, Красногвардейский переулок, 23Е","Полная занятость, полный день",3–6 лет,False,False,"Приглашаем инженера по тестированию оборудования присоединиться к сильной команде разработки оборудования ""СКАУТ разработчик системы"", которая занимается созданием широкого спектра проектных решений в сфере логистики и транспортной безопасности.Основные задачи:  Комплексное тестирование работы аппаратных модулей на основе микроконтроллеров, разрабатываемых Компанией, в составе программно-аппаратного комплекса Разработка утилит и скриптов для автоматизации типовых сценариев тестирования аппаратных модулей Тестирование встраиваемого и прикладного ПО Компании и воспроизведение дефектов Составление и расширение чек-листов и тест-кейсов Ведение базы данных обнаруженных багов (дефектов) Участие в составлении требований к разрабатываемым продуктам Участие в автоматизации процессов тестирования и разработка автотестов  Наши ожидания от кандидатов:  Высшее техническое образование, опыт в области тестирования, автоматизации. Опыт/умение работать с электронным оборудованием (настройка, диагностика, подключение и др.) Знание и понимание практик и методологий QA (контроля качества), методик тестирования Знание скриптовых языков (Python, Lua, Perl) и опыт применения их на практике Опыт тестирования программно-аппаратных комплексов Умение анализировать, вычислять и воспроизводить сложновоспроизводимые ошибки Умение работать как самостоятельно, так и в команде   Навыки работы с системами контроля версий  Мы предлагаем: Работа в компании - лидере отрасли. Нашими Партнерами являются почти 350 организаций в 84 регионах России и СНГ, а среди клиентов такие компании, как PepsiCo Россия, Газпромнефть, Транснефть, аэропорт Пулково, Роснефть, КО «Славянка», Татнефтепродукт, и др.Возможность работать в интересном, творческой и молодом коллективе единомышленников.Мы организуем обучение для наших сотрудников и рады, когда коллеги продвигаются по карьерной лестнице внутри компании.Премии за долгосрочное сотрудничество и др. - это тоже приятные особенности работы в нашей команде.График работы: пятидневка (гибкое начало рабочего дня, время прихода с 8.00 до 10.00), 8-ми часовой рабочий день.Территориально мы находимся в 15 мин. пешком от ст.м. Лесная или 10 мин. пешком от ст.м. Черная речка.",2022-01-19,['Тестирование']
2,https://nn.hh.ru/vacancy/47971903?from=vacancy_search_list&query=lua&hhtmFrom=vacancy_search_list,Level Game Designer,False,Wargaming St. Petersburg (Lesta Studio),False,Санкт-Петербург,"Полная занятость, полный день",1–3 года,False,False,"Мы в Lesta Studio (Wargaming St.Petersburg & Moscow), помимо флагманской игры World of Warships и консольной WOWS Legends, ведем разработку новых игровых проектов в различных жанрах и для разных платформ. Одна из команд в нашей студии занимается прототипированием нового кросс-платформенного ММО шутера в Sci-Fi сеттинге, в разработке которого используются движок Unreal Engine 4, Java и С++. У нас амбициозные планы по дальнейшему развитию проекта, с чем нам может помочь Level Designer. Чем предстоит заниматься:  Проектирование, прототипирование, создание и скриптование карты игры. Проведение анализа игровых данных (собранные метрики активности игроков на карте). Написание и актуализация технической документации. Участие в плэйтестах карты и итеративное внесение улучшений. Участие в настройке параметров игровой экономики и внутриигрового контента. Взаимодействие с художниками, дизайнерами и проектной командой по созданию уровней игры как целостного игрового пространства.  Что для нас важно:  Опыт работы с Unreal Engine 4 или Unity или аналогичный опыт работы от 1 года с другими игровыми движками для создания уровней игры. Знание скриптовых языков, например, Lua или Python. Умение проектировать, прототипировать, создавать и скриптовать карты игры. Умение работать с визуальными скриптами, например UE Blueprints, интеграция и настройка интерактивных ассетов. Наигранность: большой игровой опыт (разных жанров и платформ), плюсом будет знание проектов Wargaming’а.  Плюсом будет:  Опыт создания модов для разных игр. Опыт успешно разработанных игр для PC и консолей и работы в большой кросс-функциональной команде. Хорошее понимание эргономики человеческого пространства, функциональной урбанистики, архитектуры или геологии. Навыки полигонального моделирования и знание Excel. Участие в плэйтестах и анализ поведения игроков. Понимание инструментов, технологий, процесса разработки игр. Знание английского языка на уровне Intermediate и выше. Умение работать с системами контроля версий (Git, SVN).  Что предлагаем:  Работа в офисе в г.Санкт-Петербург. Мы поможем в релокации (проживание в корп.квартире, релокационный бонус). Расширенный полис ДМС. Спорт: компенсация 50% стоимости годового абонемента в различные фитнес-клубы; свой спортзал в офисе. Обучение: уроки английского языка в офисе; внутренние и внешние конференции, тренинги. Бесплатные завтраки и ужины. Релакс-зоны с массажными креслами и топовыми кофемашинами. Мы тестируем наши продукты в игровых с мощным железом и приставками. Но если хотите размяться в офлайне, у нас есть настольный теннис, хоккей, баскетбол и кикер. Work-life balance: начало работы - с 9 до 10, окончание - с 18 до 19.  Подробнее о том, как Wargaming использует Ваши данные, читайте в Политике конфиденциальности в отношении соискателей Wargaming",2022-01-20,['Unreal Engine']
3,https://nn.hh.ru/vacancy/50718853?from=vacancy_search_list&query=lua&hhtmFrom=vacancy_search_list,Golang разработчик,False,ООО Эйчэфти Арбитраж,False,"Новокузнецкая, Москва, Садовническая набережная, 9","Полная занятость, удаленная работа",3–6 лет,False,False,"О компании: Мы разивающийся стартап на стадии запуска продукта. Команда состоит из квалифицированных аналитиков в области рисков, технических аналитиков, трейдеров с большим опытом на различных рынках и разработчиков с прямыми руками. Разрабатываемая продуктовая линейка:   Криптобиржа деривативов - это основной продукт   Арбитражный робот, интегрируемый с крупными биржами по API   Middleware API, предоставляемый клиентам для интеграции с другими биржами   Процессинг криптовалют   Кошелёк с холодным хранением   Для реализации поставленных задач мы приняли стратегическое решение использовать HighLoad-архитектуру, ориентированное в первую очередь на роботов и высокочастотную торговлю. Кого ищем: В первую очередь хотим видеть от разработчика способность браться за крупные задачи, и живые математические навыки. Обязанности: Разработка backend-приложения Работа в Scrum-команде Требования:  Опыт разработки на Golang от 3 лет и отличное знание языка и экосистемы Участие в разработке высоконагруженных приложений Умение решать проблемы высокой доступности Опыт работы с распределёнными СУБД: ClickHouse (основная), PostgreSQL Хорошее понимание Redis Опыт использование и тюнинг брокеров сообщений в разработке NATS, Kafka Написание юнит и блочных тестов  Желательно:  Опыт работы в финтех проектах приветствуется Lua для Redis Опыт работы с данными в формате Time series Уметь брать на себя ответственность Знание Docker, Kubernetes желательно Использование git-flow  Условия:  Интересные задачи, использование передовых технологий; Оклад от 280 000 на руки Гибкий график начала рабочего дня MacBook Pro ",2022-01-20,['Redis']
4,https://nn.hh.ru/vacancy/51481335?from=vacancy_search_list&query=lua&hhtmFrom=vacancy_search_list,Lua Game Developer,False,TheSoul Publishing (AdMe),False,Москва,"Полная занятость, удаленная работа",1–3 года,False,"Возможно временное оформление: договор услуг, подряда, ГПХ, самозанятые, ИП","








TheSoul Publishing — одно из самых крупных интернет-издательств в мире. Наша команда из 2100+ человек в 70+ странах каждый день создаёт развлекательный контент: мы снимаем видео, рисуем анимацию, пишем статьи для 1 млрд+ подписчиков по всему миру. Среди наших проектов: 5-Minute Crafts, La La Life, AdMe.ru, Avocado Couple и ещё 40+ других. Мы быстро растем и активно нанимаем креативных и талантливых людей по всему миру. Сейчас мы в поиске увлеченного игрока Minecraft, который поможет нам создавать потрясающие видео для нашего Let's Play стартап-канала на YouTube Обязанности:   Написание сценариев миссий   Написание скриптов для взаимодействия с локациями (например, выпадающие элементы из ящиков)   Написание скриптов развития персонажа   Написание скриптов для структуры системы донатов   Требования:   Знание языка программирования Lua выше среднего или JavaScript   Наличие опыта работы в игровой индустрии на уровне создания инди-проектов или хотя бы на уровне full-tme работы с Roblox   Понимание принципов построения игровых сценариев, сюжета и миссий   Умение творчески мыслить, выходить за поставленных задач   Ответственный подход к рабочему процессу, умение работать в классическом графике 5/2 с постоянным общением в течение рабочего дня   Страсть к играм и игровой индустрии в целом :)   Несомненным плюсом будет:  Знание английского языка хотя бы на уровне A2 Опыт работы с Unreal Engine  Что мы предлагаем:   Зарплата: мы уважаем компетентность каждого кандидата, поэтому обсуждаем размер индивидуально и предлагаем комфортную и конкурентоспособную сумму;   Возможность работать из дома в любимых тапочках или без них;   Классную неравнодушную команду;   Развивающие и интересные проекты.   Спасибо вам за интерес к нашей компании и вакансиям. Мы внимательно изучим ваше резюме и свяжемся с вами в случае, если будем готовы предложить вам выполнить тестовое задание или пригласить на интервью. ​TheSoul Publishing— работодатель, который предоставляет всем кандидатам равные возможности, а сотрудникам - дружескую атмосферу, в которой легко адаптироваться. Мы приветствуем разнообразие - в нашей команде нет места дискриминации по национальности, религии, половой принадлежности и гендерной идентификации, а также по месту проживания, возрасту, физическим возможностям, сексуальной ориентации, семейному положению и другим характеристикам, охраняемым законом. Мы заботимся о частной жизни кандидатов: все полученные данные остаются строго конфиденциальными.
















Подбор персонала ведется в ADME (CY) LTD. ADME (CY) LTD входит в группу компаний TheSoul Publishing, которая также работает под брендом ADME

",2022-01-21,['Английский\xa0— A2 — Элементарный']
5,https://nn.hh.ru/vacancy/51181484?from=vacancy_search_list&query=lua&hhtmFrom=vacancy_search_list,Embedded Linux программист,False,ООО Геоскан,False,"Площадь Мужества, Политехническая, Санкт-Петербург, улица Шателена, 3","Полная занятость, полный день",1–3 года,False,False,"Мы создаем беспилотные летательные аппараты и программное обеспечение для промышленности, образования и индустрии развлечений. Наше оборудование используют для цифрового картографирования, автоматизации контроля строительства, разведки месторождений полезных ископаемых и точного земледелия в 130 странах. Школьники и студенты изучают программирование и робототехнику с помощью наших комплексов, а геймдизайнеры наполняют свои миры трехмерными моделями, построенными в Agisoft Metashape. В связи с увеличением количества проектов, мы расширяем отдел разработки ПО для РЭА и ищем Embedded Linux программистов. Чем предстоит заниматься:  разрабатывать программное обеспечение для встраиваемых вычислительных систем на базе процессоров с ядром Cortex-A;  подготавливать документацию по сборке и использованию ПО.   Мы ожидаем, что вы:  имеете опыт по сборке и подготовке дистрибутивов (подготовка набора приложений, компиляция этих приложений под целевую платформу и подготовка пакетов для дальнейшей поставки в составе дистрибутива); хорошо знаете C/С++; имеете опыт работы с ядрами ARM Cortex-A; способны разрабатывать и отлаживать драйвера для Linux; владеете английским языком на уровне чтения технической документации; имеете опыт работы с системами контроля версий.  Будет плюсом, если вы:  знакомы с интерпретируемыми языками, например: Lua, Python, JavaScript; разрабатывали приложения на Qt; имеете опыт отладки устройств, умеете работать с современными приборами.  Что мы предлагаем:  оформление в соответствии с ТК РФ и полностью белую заработную плату; молодой коллектив, с большим количеством специалистов из разных сфер, у которых можно многому научиться; гибкий график работы; современный комфортный офис с пуфиками и капучино; еженедельный спорт (футбол, волейбол, баскетбол), корпоративные выезды на природу; полис ДМС после 1 года работы; изучение английского языка в офисе с 50% компенсацией от компании; корпоративную библиотеку с бестселлерами из разных областей знаний. ",2022-01-20,['Linux']
