,url,title,salary,company_name,company_verified,adress,employment_mode,experience,parttime,accept_temporary,description,creation-time,tag
0,https://nn.hh.ru/vacancy/47472158?from=vacancy_search_list&query=lua,Golang Developer,от 12 500 до 16 000 бел. руб. на руки,ООО МАКСБИТСОЛЮШЕН,True,"Академия наук, Площадь Победы, Минск, переулок Козлова, 25","Полная занятость, удаленная работа",3–6 лет,False,False,"MAXBITSOLUTION - IT-компания, создающая проекты в сфере iGaming. Мы разрабатываем высоконагруженные системы с использованием Vue.js, PHP, Ruby on Rails и Go, а также управляем трафикообразованием и лидогенерацией. Какие продукты мы создаем? Крупные развлекательные онлайн-проекты и приложения для iOS и Android. Наша команда активно растет, и мы приглашаем присоединиться к нам опытного Golang разработчика для реализации серверной части нашего продукта. Чем предстоит заниматься:   разработкой backend-приложения;  активно применять микросервисную архитектуру.   Нам нужен именно ты, если у тебя есть:   опыт разработки на Golang от 2-х лет и глубокое знание языка и экосистемы;   опыт разработки высоконагруженных приложений, опыт работы с микросервисами;   опыт реализации схем Failover Recovery;   опыт работы с базами PostgreSQL, Redis;   опыт написание юнит и блочных тестов.   Будет весомым преимуществом:   наличие open-source проектов;   умение пользоваться git flow;   опыт работы в гейм проектах;   понимание Docker, Ansible, Kubernetes;   умение писать простые скрипты на Lua.   Мы предлагаем:   работу в молодом и дружном коллективе;   безграничные возможности для профессионального роста и самореализации;   комфортное рабочее место в современном офисе с террасой в центральной части города;   оборудованную кухню с кофе, орехами, свежими фруктами и прочими вкусняшками;   современное техническое оснащение (мощное железо, дополнительные мониторы, и все, что нужно для работы);   курсы английского языка;   бесплатную парковку рядом с офисом;   3 sick days;   интересные корпоративные мероприятия.  ",Вакансия опубликована 6 октября 2021 в Минске,"['PostgreSQL', 'Redis', 'Работа в команде', 'Scrum', 'Git', 'Failover Recovery']"
1,https://nn.hh.ru/vacancy/48451885?from=vacancy_search_list&query=lua,С/С++ Linux разработчик (remote),до 5 000 USD до вычета налогов,ООО Темпеста,True,"Сиэтл, 4th Ave","Полная занятость, удаленная работа",более 6 лет,False,False,"Мы разыскиваем талантливого, любящего свое дело, C/C++ Linux разработчика на постоянную удаленную работу с гибким графиком, который станет частью нашей небольшой команды. Мы работаем удаленно по гибкому графику с использованием идей SCRUM и специализируемся на низкоуровневой разработке высокопроизводительных систем. С 2008 года нашими клиентами стали MariaDB (кстати, мы - один из крупнейших контрибьюторов), Percona, SanDisk, Skype, CloudLinux и другие известные международные компании. Вместе с нами Вы будете заниматься глубокими доработками MySQL/InnoDB (пример сделанного нами проекта - MariaDB System Versioning, Linux kernel, Nginx и других популярных open source проектов. Будете анализировать высоконагруженные Linux системы и делать их еще быстрее. А между заказными проектами участвовать в разработке нашего open source продукта Tempesta FW, Мы разработали реализацию TLS handshakes для Linux kernel, которая в несколько раз обгоняет Nginx/OpenSSL или Nginx/WolfSSL. О Tempesta TLS можно посмотреть в нашем докладе на FOSDEM’21. А сейчас мы работаем над внесением Tempesta TLS в основную ветку ядра Linux. По желанию, вы сможете стать соавтором статей и содокладчиком на ведущих международных конференциях, посвященных Linux kernel networking и СУБД.   Обязательные навыки:  Уверенное владение C, хороший С++ или желание его изучить Хорошее понимание устройства Linux и его системного API Знание классических алгоритмов и структур данных Опыт разработки многопоточных приложений (POSIX, C++ STL)    Желательно:  Опыт в разработке для Linux kernel (kernel/, mm/, net/, security/) Владение Python для написания тестовых скриптов Владение или желание изучить Lua (LuaJIT) для использования в OpenResty, wrk, sysbench Хороший письменный английский для общения с зарубежными партнерами и заказчиками    Условия:  Заработная плата от $2,000 до $5,000 по контракту с нашим офисом в США Возможность работы из дома Гибкий график для работы в комфортное время ",Вакансия опубликована 4 октября 2021 в Москве,"['C/C++', 'Linux', 'Multithread Programming', 'Алгоритмы и структуры данных', 'Удаленная работа', 'C++']"
2,https://nn.hh.ru/vacancy/48414383?from=vacancy_search_list&query=lua,DevOps engineer,з/п не указана,"ШАГ, Компьютерная Академия",True,Киев,"Полная занятость, полный день",1–3 года,Возможна подработка: по вечерам,False,"






Мы Международная компания с экспертизой в сфере IT образования. Сейчас находимся в поиске DevOps Основные задачи  Поддержка процессов CI/CD Поддержка работы парка серверов Автоматизация внутренних процессов Реагирование на инциденты системы мониторинга  Необходимые навыки  Опыт работы: 2+ OS: Linux (Debian/CenOS), WinServer 2008/2012 Языки программирования: LUA / BASH / PowerShell / PHP & PYTHON Опыт работы с: VCS: GIT (BitBucket/GitLab) CI systems: Jenkins/GitLab Virtualization/containerization: Docker/LXC/KVM Web server NGINX Mysql/PostgreSQL/MSsql/Redis/ClickHouse Monitoring system Zabbix   Central logs system ELK Stack  Мы предлагаем:  Работу в профессиональной команде продуктовой IT-компании с интересными проектами. Конкурентную зарплату. Работа в современном офисе в г. Днепре или удалённо Рабочий день 09:00 — 18:00, либо 10:00 — 19:00 + дежурства Оплачиваемый отпуск 24 календарных дня.  Наша команда уверенна в том, что ключ к успеху — люди: которые ценят и любят свою профессию, которые хотят видеть свою значимость не только для своей команды, но и для тех, для кого мы воплощаем наши идеи. Добро пожаловать в команду! «Объединяться вместе — начало, быть вместе — прогресс, и работать вместе — успех.» — Henry Ford





",Вакансия опубликована 6 октября 2021 в Киеве,"['Linux', 'Bash', 'Git', 'Nginx', 'Python']"
3,https://nn.hh.ru/vacancy/47734241?from=vacancy_search_list&query=lua,Разработчик Golang / Developer Golang,от 200 000 до 450 000 руб. до вычета налогов,ООО ВФМ технолоджи,True,"Москва, Тверская улица, 16с3","Полная занятость, гибкий график",3–6 лет,False,False,"Приглашаем бекенд-разработчикa с отличным знанием Golang, который примет активное участие в разработке продукта и проектировании архитектуры вместе с командой, готового присоединиться к написанию ядра платформы, а также к разработке собственных сервисов и интеграций. Поэтому готовы рассмотреть кандидатов, которые любят и умеют решать сложные технические задачи, и тех, кто хочет быть ближе к продукту и непосредственно влиять на него. О нас: «ВФМ Технолоджи»- IT-компания разрабатывающая решения по управлению ресурсами бизнеса и самозанятыми. Наши проекты улучшают жизнь людей. Области применения: WFM (WorkForceManagement), ERP (EnterpriseResourcePlanning). В нас верят компании из топ-30 РФ. Основной стек технологий проекта: Golang, Lua, GraphQL, Cockroach, Tarantool, Kubernetes, Jira/Confluence, Gitlab, CI/CD. Что надо будет делать: - Участвовать в разработке высоконагруженной WFM системы (workforce management) с применением Golang - Развивать архитектуру платформы; - Проектировать и разрабатывать интеграционные, инфраструктурные и прикладные сервисы; - Участвовать в оценке техдолга. Мы ожидаем, что Вы можете владеть следующими навыками: — Знаете и применяете на практике алгоритмы и структуры данных; — Отличное знание Golang; — Знаете GraphQL; — Имеете опыт в разработке высоконагруженных и отказоустойчивых сервисов; — Умеете самостоятельно разрабатывать и реализовывать архитектуру высоконагруженных отказоустойчивых решений; — Имеете oпыт коммерческой разработки не менее 5-ти лет; — Пишете качественный и надежный код, покрытый тестами; — Разрабатывали многопоточные приложения; — Знакомы с Linux и умеете работать с командной строкой; — Имеете опыт проектирования систем с нуля; — Умеете проводить код-ревью. Почему у нас круто работать? - Конкурентная заработная плата и возможности для профессионального роста - Масштабный долгосрочный проект, влияющие на тысячи пользователей - Фокус на результате, гибкие методологии и принятие решений консенсусом - Возможность влиять на конечный результат и понимать бизнес-логику продукта Что мы предлагаем: - ЗП от 200 до 450 тыс.руб (по результатам собеседования) - Официальное трудоустройство - Рабочий день 8 часов с Пн-Пт - Возможность работы в гибридном режиме (3 дня в офисе, 2 дня из дома), либо удалённая работа - Работу в социальном проекте - Мы предоставляем технику по вашему выбору - Крутые задачи, быстрое развитие - скучно не будет - Работа в сплочённом IT-коллективе - Работа из современного офиса в Москве (1 мин от метро Чеховская, Пушкинская, Тверская).",Вакансия опубликована 4 октября 2021 в Москве,"['CI', 'CI/CD', 'Golang', 'Git', 'Lua', 'GraphQl', 'Cockroach', 'Tarantool', 'Kubernetes', 'Jira/Confluence', 'Gitlab']"
4,https://nn.hh.ru/vacancy/38623579?from=vacancy_search_list&query=lua,Разработчик AI (поведение игрового юнита),до 150 000 руб. на руки,Eagle Dynamics,True,"Водный стадион, Москва, Головинское шоссе, 5к1","Полная занятость, полный день",1–3 года,False,False,"Компания Eagle Dynemics - ведущий разработчик авиационных симуляторов, известных во всем мире. Создатель DCS World У нас собраны ведущие специалисты в области авиационных симуляторов и тренажеров, объединенные общей идеей создавать максимально реалистичные игры. Обязанности:  разработка алгоритмов логики и искусственного интеллекта игровых юнитов взаимодействие с графической подсистемой разработка инструментов для отладки и подготовки исходных данных  Требования:  уверенное знание С++ стандарта 11 и выше Windows, MSVC 2017 и выше знание STL, шаблонов, разработки под Windows умение отлаживать и профилировать код знание паттернов и антипаттернов умение работы с внешнми библиотеками знания линейной алгебры (вектора, матрицы) базовые знания дифференциальных уравнений, динамических систем необходимо знание алгоритмов графов, поиска путей, избегания препятствий, группового поведения знакомство с машинами состояний, деревьями поведений знание физики (кинематика) английский язык скриптовые языки (Lua - желательно, Python) приветствуются знания трехмерной графики и представление о скелетной анимации полезен будет опыт работы с трехмерными движками (Unreal, Unity и пр.) плюсом будет умение работать в математических пакетах (Matlab, Octave и пр.)  Работа в офисе в Москве (м. Водный стадион). Соблюдение ТК Достойная белая зарплата Перспективы карьерного роста",Вакансия опубликована 6 октября 2021 в Москве,"['C++', 'Lua', 'MSVC', 'Python', 'Unreal', 'MATLAB', 'Octave']"
5,https://nn.hh.ru/vacancy/48545415?from=vacancy_search_list&query=lua,Системный администратор VOIP/Linux (в Сочи),от 100 000 руб. на руки,ООО Колл-Тулз,True,"Сочи, микрорайон Центральный, улица Горького, 75","Полная занятость, полный день",1–3 года,False,False,"Привет, кандидат! Мы разрабатываем крутой сервис интерактивной телефонии zvonok.com. Ищем в свою команду ещё одного системного администратора VOIP/Linux. Важно! Ищем сотрудника с уклоном в VOIP. Опыт администрирования Windows не релевантен, у нас всё построено на Linux. Проект сложный и очень интересный. Вы получите опыт живой бизнес-разработки (вся обратная связь поступает моментально), опыт работы с высоконагруженными системами, практику командной разработки с применением современных инструментов и подходов. Вакансия в Сочи, удалённая работа невозможна. Иногородних кандидатов приветствуем, помогаем с переездом: оплачиваем билет и предоставляем квартиру на первый месяц. Почему именно мы?   У нас действительно интересно работать;   Все наши сотрудники - профессионалы своего дела;   Гарантируем быстрый профессиональный рост;   Наш офис находится в самом центре Сочи (рядом транспорт, море и общепит);   Мы предлагаем официальное трудоустройство, оплачиваемые отпуск и больничный;   У нас дружный коллектив, интересная корпоративная жизнь, PlayStation и пицца по пятницам.   Обязанности:   Участие в разработке, проектировании и поддержании работы отказоустойчивых VOIP систем, работающих непрерывно и бесперебойно;   Настройка систем мониторинга и оповещения;   Требования:   Опыт администрирования ОС Linux обязателен;   SIP на уровне чтения дампов и диагностики проблем;   Опыт работы с VoIP обязателен и больше, чем “установил Freepbx и подключил N телефонов” (Kamailio/OpenSIPs, RTPEngine, Freeswitch/Asterisk);   Опыт работы с PostgreSQL;     Опыт работы с git (мы используем Gitlab);   Знание языков shell (Bash), Python, опционально Lua, Go;   Базовое понимание работы компьютерных сетей.   Будет плюсом:   Опыт работы с Docker и Ansible;   Уметь составлять и оптимизировать SQL запросы;   Опыт работы / внедрения с (несколько из):   Kubernetes;   Tarantool;   Gitlab CI/CD;   Prometheus + Grafana.     Условия:   Зарплата на старте от 100 000 руб (по результатам собеседования);   Работа в центре Сочи в комфортном офисе;   5-и дневная рабочая неделя;   Официальное трудоустройство;   Свободных график (в пределах разумного), начало рабочего дня до 12.00;   Нет бюрократии.  ",Вакансия опубликована 5 октября 2021 в Сочи,"['Linux', 'SIP', 'PostgreSQL', 'SQL', 'Asterisk', 'FreeSwitch', 'Docker', 'Python', 'VoIP', 'IP-телефония', 'Ansible', 'Tarantool', 'Kamailio', 'openSIPS']"
