,url,title,salary,company_name,company_verified,adress,employment_mode,experience,parttime,accept_temporary,description,creation-time,tag
33,https://nn.hh.ru/vacancy/51407294?from=vacancy_search_list&query=lua&hhtmFrom=vacancy_search_list,Server Developer (Vector Games),False,СберИгры,False,"Москва, улица Василисы Кожиной, 1","Полная занятость, полный день",3–6 лет,False,False,"Студия Vector Games входит в состав SberGames. Мы делаем mid-core MMORPG с элементами Match-3 и развитыми PvP RPG механиками в сеттинге фэнтези. Бэкенд нашего проекта – это сложная система, которая позволит миллионам игроков участвовать в полноценных PvP боях и взаимодействовать с обширным игровым миром. Мы ищем опытного разработчика, который обеспечит корректную и быструю работу сервера. Проект находится на старте, и у нас есть много разных интересных разноплановых задач. Кланы, система предметов и крафта, интересные многопользовательские режимы. Приходи, будет интересно! Основные задачи   Разработка административного модуля для многопользовательской сессионной игры;   Анализ требований, декомпозиция задач и оценка сроков их выполнения;   Написание, отладка и поддержка кода игровых механик;   Взаимодействие с отделами клиентских программистов, геймдизайна;   Аккуратное отношение к собственному коду, нахождение баланса между его улучшением и разработкой нового кода   Требования   Опыт работы от 3 лет;   Хорошее знание алгоритмов и структур данных;   Умение общаться, четко формулировать мысли, договариваться;   Уверенное владение PHP;   Знание и опыт работы с базами данных (предпочтительно PostgreSQL/MySQL/Redis/MongoDB);   Хорошее знание Git или Svn.   Будет плюсом   Опыт разработки серверной логики в игровых проектах;   Опыт работы в команде, практиковавшей code review, unit-тесты;   Опыт работы в игровой индустрии;   Умение писать логику на Lua;   Уверенное владение C++, C#, Go (как минимум одним).   Мы предлагаем   Классную команду, которая увлечена своей работой и стремится сделать максимально крутой проект.   Возможность присоединиться к компании на старте и влиять на ее развитие.   Возможность работать из офиса в Москве или удаленно.   Корпоративную технику с учетом твоих пожеланий.   Официальную заработную плату, оформление по ТК РФ.   И другие бенефиты, которые сейчас находятся в разработке.    ",2022-01-20,['Git']
34,https://nn.hh.ru/vacancy/51425302?from=vacancy_search_list&query=lua&hhtmFrom=vacancy_search_list,Java developer (Integration),False,Сбер для экспертов,False,Москва,"Полная занятость, полный день",1–3 года,False,False,"Требуется бэкенд-разработчик JAVA. Наша команда занимается интеграционными взаимодействиями в Сбербанк Онлайн c использованием в качестве транспорта MQ, Kafka, HTTP. Потребуется решать задачи, связанные с осуществлением подобных взаимодействий как между самими сервисами Сбербанк Онлайн, так и для их взаимодействия с другими системами Банка. И всё это в условиях высокой нагрузки. Стэк: DEV: · Java 8/11 · Spring Framework (Core, Boot) · JMS (IBM MQ / Artemis MQ) · Kafka · Maven / Gradle · Git · OpenResty (Nginx + Lua) OPS:  Jenkins Ansible Linux (RHEL) Docker Red Hat OpenShift Istio Kafka IBM MQ / Artemis MQ ELK Prometheus  Чем нужно заниматься · Разрабатывать компоненты для реализация интеграционных взаимодействий · Участвовать в проектировании технических решений в части интеграций · Проводить R’n’D Что от тебя требуется  Иметь опыт разработки и обладать уверенными знаниями Java 8 или выше Знать про паттерны разработки и уметь их применять на практике Знать, что такое Spring и как он работает (Сore, Boot) Уметь и любить писать тесты (Junit) Уметь работать с Git Иметь опыт работы с JMS и MQ Понимать, как работают протоколы TCP/IP, HTTP Знать про PKI и как работает TLS  Будет плюсом:  Опыт работы с Linux Опыт работы с Nginx Опыт работы с Kafka Опыт работы с технологиями контейнеризации и оркестрации (Docker, Kubernetes, OpenShift) Понимание принципов CI/CD  Преимущества работы в Сбере  Уникальные технологические и инновационные проекты Команда экспертов и профессионалов своего дела Развитие и обучение: своя digital-платформа для дистанционного обучения и развития ключевых ИТ-компетенций Социальный пакет (ДМС, корпоративная пенсионная программа, материальная помощь) Скидки для сотрудников от партнеров экосистемы Сбера Свободный дресс-код ",2022-01-20,['Git']
35,https://nn.hh.ru/vacancy/51006297?from=vacancy_search_list&query=lua&hhtmFrom=vacancy_search_list,Младший веб-разработчик / Junior web developer,False,Доктор Веб,False,"Санкт-Петербург, Горьковская","Полная занятость, гибкий график",не требуется,False,False,"




«Доктор Веб» — российский производитель антивирусных средств защиты информации под маркой Dr.Web®.



Мы разрабатываем комплексные решения в области кибербезопасности с 1992 года как для личного пользования, так и для малого и среднего бизнеса, крупных российских предприятий, системообразующих корпораций и государственных структур Российской Федерации.



Собственные уникальные технологии детектирования и лечения вредоносных программ, антивирусная лаборатория, глобальная служба вирусного мониторинга и служба технической поддержки — все это позволяет нам эффективно обеспечивать защиту миллионов пользователей по всему миру.



Российские офисы «Доктор Веб» находятся в Москве, Санкт‑Петербурге и Новосибирске. Наши дочерние компании расположены во Франции, Германии, Японии и Казахстане.




«Доктор Веб» создает антивирусные решения для различных операционных систем и мобильных платформ, для домашнего использования и для централизованной защиты крупных компаний. В нашей команде отзывчивые сотрудники и технически грамотные руководители. Мы стараемся поддерживать комфортную атмосферу, прислушиваемся к пожеланиям и обеспечиваем всем необходимым для работы.Сейчас мы ищем талантливого разработчика в команду, которая занимается разработкой веб-интерфейсов корпоративных продуктов.Обязанности:  Разработка и поддержка корпоративных продуктов.  Требования:  Front-end: знание HTML, CSS, JS; Back-end: знание любого серверного языка (PHP, JS); Кроссбраузерная верстка (обязательно примеры работ); Знание SQL, особенностей разных СУБД; Опыт работы в команде и с чужим кодом; Опыт работы с Git.  Желательно:  Знание Lua; Опыт написания тестов; Знание HTML5, ES6, CSS3, React  Мы предлагаем:  Официальное трудоустройство; Современный офис на Петроградской стороне; Гибкий график работы; Конкурентоспособную заработную плату (обсуждается индивидуально, зависит от вашего опыта и квалификации); Горячие обеды, фрукты, напитки; ДМС, включая стоматологию; Зону отдыха, тренажеры, полезные для работы книги. 



",2022-01-21,[]
36,https://nn.hh.ru/vacancy/51025876?from=vacancy_search_list&query=lua&hhtmFrom=vacancy_search_list,3D Graphics Software Engineer (remote),False,WayRay,False,Новосибирск,"Полная занятость, удаленная работа",3–6 лет,False,False,"Swiss-based tech startup WayRay is a game changer in the field of automotive and augmented reality technologies. With offices around the world and $100 million of investment, we are seeking ambitious individuals to join our fast-growing team. At WayRay, we believe that we are never done learning and growing. We are a team of professionals that are continuously gaining new knowledge, experimenting with new approaches, and developing our emotional intelligence. At present, we are looking for a 3D Graphics Software Engineer to be a key member of the Software department which is developing a rendering engine. You will work closely with two graphics developers and the rest of the software team. This team utilizes an agile methodology to be more flexible and result oriented. Primary tasks  Developing the rendering engine (scene rendering, geometry generation, post-processing effects) and implementing new functionality Implementation of new visual features API extension for SDK Developing a virtual simulator for road testing  Requirements  Strong knowledge of C++11 and C++ Standard Library (knowledge of new C++ 14/17 is a plus) Experience with OpenGL/OpenGL ES Knowledge of linear algebra (matrix transformations, quaternions, etc.) Linux applications development experience Ability to communicate ideas effectively and collaborate closely with a cross-functional team to achieve goals  Bonus skills  Commercial 3D software development experience Knowledge of Unity/UE4 engines Experience with Lua  What we offer  Opportunity to work in a game-changing company alongside the best professionals from all over the world Transparency and openness at all levels Immersion in the Deep Tech culture where we give birth to real innovations Benefits package including educational opportunities and stock option plan for all positions and grades Competitive salary and bonus for outstanding results Yearly big party and regular corporate events ",2022-01-22,['C++']
37,https://nn.hh.ru/vacancy/50097185?from=vacancy_search_list&query=lua&hhtmFrom=vacancy_search_list,Преподаватель по программированию,False,IT школа Hello world,False,Краснодар,"Полная занятость, удаленная работа",1–3 года,Возможна подработка: сменами по 4-6 часов или по вечерам,False,"IT-школа HelloWorld – самая большая и быстрорастущая онлайн-школа в России. Главная ценность школы - Развитие, поэтому уже с момента собеседования мы непрерывно обучаем всех сотрудников. Мы преподаем курсы по следующим направлениям:  Компьютерная грамотность Графический дизайн в редакторе Figma Программирование на языке Scratch Создание 3D игр в Roblox Создание сайтов Front-end разработка Программирование на языке Python Создание игр на Unity.  Вы нам подходите, если:  Окончили или учитесь в IT, техническом или педагогическом ВУЗе; Имеете опыт преподавания; Получили дополнительное образование или прошли профессиональную переподготовку в сфере IT; Готовы работать от 20 часов в неделю в вечернее время и/или в выходные дни.  Что нужно делать:  Проводить занятия в онлайн-формате; Контролировать качество учебного процесса; Обеспечивать обратную связь родителям.  Мы предлагаем:  Работу в большом и дружном коллективе; Гибкий график работы; Полную либо частичную занятость – на выбор; Методические материалы к урокам; Полностью официальное трудоустройство согласно ТК РФ; Прозрачную систему мотивации; Возможность карьерного роста до наставника, куратора, методиста, руководителя направления; Обучение английскому с носителем языка; Программу повышения квалификации по softs skills и hard skills; Скидки для детей сотрудников на обучение в нашей школе. ",2022-01-21,['Python']
38,https://nn.hh.ru/vacancy/51480930?from=vacancy_search_list&query=lua&hhtmFrom=vacancy_search_list,Backend Developer C#/ .Net,False,Boxberry: IT,False,Екатеринбург,"Полная занятость, удаленная работа",1–3 года,False,False,"







Хочешь узнать больше о нашей ИТ-команде?
Читать ИТ -статью



Boxberry работает на российском и международном рынке как служба доставки. На данный момент:клиентами Boxberry являются более 8000 интернет-магазинов, в числе которых ТОП-200 Российского и Западного рынка e-commerce （iherb, ASOS, Беру, Яндекс.Маркет и др.）;территория присутствия - 600 отделений в 750 городах России и зарубежья; Мы разрабатываем высоконагруженное ПО, в котором работают одновременно сотни внутренних пользователей и внешние веб-клиенты (сайт, личный кабинет, API и все дружит с 1С через веб-сервисы). Сейчас мы в поисках- Backend Developer C# Вакансия открыта в группе разработки ""Биллинг""  (система тарификации услуг компании для интернет-магазинов и физ.лиц: предварительная и фактическая (калькулятор и оценка конечной стоимости)) Высоконагруженный сервис (микросервисная архитектура, есть пользовательский интерфейс) Требования к кандидатам  Разрабатывали на С# от двух лет, .Net Core (2.x), .Net 5 Умеете работать с системой контроля версий Git Опыт работы с ORM (Entity Framework) Начальные знания Linux и понимание микросервисной архитектуры Опыт разработки веб-приложений, их интеграции с PostgreSQL, Работали с RabbitMQ и Liquibase Знаете CI/CD  !как большой плюс// - наличие опыта промышленной разработки Java -(Spring), PowerShell, Lua - умение работать с инструментами мониторинга Zabbix/Grafana/Prometheus. Задачи:  Поддержка, оптимизация и доработка существующего ПО компании (высоконагруженные внешние и внутренние сервисы, backend веб-приложений). Оптимизация в условиях роста нагрузки ( сейчас порядка 3,5 млн.запросов в день, и будет расти) Разработка нового функционала и сервисов.  Мы ценим своих сотрудников и предлагаем:  Конкурентные условия труда (белая заработная плата); График работы – стандартный, но с гибким подходом; Корпоративное обучение; Команда единомышленников: совместная работа с другими командами разработки, тестирования и девопс. Возможна работа в офисах Брянска, Екатеринбурга, Омска или удаленка 








",2022-01-21,['C#']
39,https://nn.hh.ru/vacancy/51463198?from=vacancy_search_list&query=lua&hhtmFrom=vacancy_search_list,Backend-разработчик / Программист PHP (Symfony),False,RAISON,False,"Москва, Варшавское шоссе, 1","Полная занятость, удаленная работа",3–6 лет,False,False,"Кто мы: RAISON — инвестиционная платформа, которая меняет правила игра на рынке частных технологических компаний. Raison дает доступ каждому в закрытый рынок private equity, позволяя инвестировать в такие компании как SpaceX, Airbnb, Robinhood, Klarna, Kraken до их выхода на публичный рынок с минимальным чеком до 1 евро. Мы фокусируемся на европейском и азиатском рынках, позволяя получить опыт работы в международной компании. Нам уже более 3 лет, мы вошли в Top 5 Fintech Startups по мнению TechCrunch. Головной офис расположен в Эстонии, офис разработки — в Москве. Мы работаем над мобильным приложением iOS и Android, используем React.js, backend реализован на PHP7 (Symfony) + Golang. У нас построена удобная экосистема разработки (Kubernetes, Gitlab, CI/CD, Docker, Jira, Confluence, Slack, Grafana, Prometheus) и высокопрофессиональный коллектив, у которого есть чему поучиться. Работать можно как удаленно, так и в удобном современном офисе в центре Москвы. Мы ищем backend-разработчиков (PHP) со знанием Symfony 5. Вам предстоит:  Поддерживать существующую кодовую базу — основная часть написана на PHP (Symfony 5), некоторые микросервисы на Go; Развивать функционал системы, обеспечивая отказоустойчивость и безопасность данных; Придумывать интересные и нетривиальные решения для работы с финансовыми транзакциями и блокчейн-технологиями; Писать читаемый код и работать в команде единомышленников.  Вам понадобятся:  Глубокие знания PHP 7 и MySQL; Опыт разработки и поддержки сложных web-проектов на Symfony 5; Опыт использования различных инструментов и средств в среде web - Nginx, NoSQL-хранилища, системы очередей; Понимание базовых аспектов функционирования сети - протоколы, DNS, балансировка; Умение писать читаемый код и покрывать его тестами; Знание Unix-систем; Умение работать с Docker; Опыт командной работы и использования инструментов для нее (GIT, Gitflow, Jira);  Приветствуется:  Опыт работы с blockchain-технологиями: Bitcoin, Ethereum; Опыт client-side разработки (Vue.js, React.js); Умения использовать инструменты в среде web — системы мониторинга, кеширования, хранения данных; Знания других языков программирования: GoLang, C/C++, Lua;  Условия: Конкурентная заработная плата по результатам собеседования;Отличные возможности для профессионального роста;Возможна удаленная работа;При желании можно работать в уютном офисе на м. Тульская, с игровой комнатой, фруктами, кофе, чаем - и печеньками :)",2022-01-21,['Git']
