,url,title,salary,company_name,company_verified,adress,employment_mode,experience,parttime,accept_temporary,description,creation-time,tag
53,https://nn.hh.ru/vacancy/48523319?from=vacancy_search_list&query=lua,Разработчик решений (проект Tarantool),з/п не указана,"Mail.ru Group, Решения для бизнеса",True,Москва,"Полная занятость, полный день",3–6 лет,False,False,"





Tarantool
Tarantool — это платформа in-memory вычислений с гибкой схемой данных для эффективного создания высоконагруженных приложений.
Tarantool Community Edition сочетает в себе сервер приложений, гибридное хранилище с гибкой схемой данных и мощные средства масштабирования. Он позволяет реализовать множество архитектурных паттернов высоконагруженных сервисов: от key-value хранилища до распределённого транзакционного кэша и интегрировать их в ИТ-инфраструктуру. 
Tarantool Enterprise Edition позволяет реализовать множество решений по хранению и интеграции данных: от простого in-memory key-value хранилища до высокоскоростного отказоустойчивого кэша и систем enterprise-уровня, таких как Client-360. Tarantool предоставляет готовые компоненты для развертывания, администрирования, обеспечения безопасности и интеграции создаваемых бизнес-решений с ИТ-инфраструктурой. Таким образом сокращается time-to-market и стоимость готового решения. Премиальная поддержка и SLA от вендора позволяют использовать Tarantool для mission-critical сервисов.



Наша команда разрабатывает Tarantool Data Grid, который является основным коммерческим продуктом Tarantool. Этот продукт используют различные крупные заказчики. Интеграция его производится силами команды решений. В основе наших продуктов лежит application-сервер и база данных Tarantool, а также инфраструктура, выстроенная вокруг него. Так как наши заказчики используют TDG для ускорения и модернизации своих внутренних систем, то часто приходится ожидать больших нагрузок и высокой стоимости отказа. Так что TDG мы создаем с прицелом на высокую доступность, высокие нагрузки и удобство пользователей.Чем предстоит заниматься:  развивать и поддерживать TDG; как непосредственно писать код, так и участвовать в генерации продуктовых идей.  Требования:Для разработчиков наш проект является достаточно нестандартным и уникальным, поэтому мы ждем человека, который:  готов писать на языке Lua; имеет опыт работы с любым высокоуровневым языком; знает Linux; представляет себе проблемы эксплуатации продуктов; плюсом будет понимание работы распределенных систем; плюсом будет знание web-стека.  Работа в Mail.ru Group ― это:  проекты большого масштаба: соцсети, почтовые сервисы, киберспорт, портал, игры, электронная коммерция ― в каждом есть возможность делать жизнь миллионов людей лучше; сложные и интересные задачи: высоконагруженные сервисы, которые задают уровень для конкурентов качеством и технологиями; быстрый рост в трендовых направлениях; амбициозные цели перед каждым проектом; оборудование: мощное железо, дополнительные мониторы, специализированные гаджеты ― все для решения масштабных задач и экспериментов; команда: работа бок о бок со «звездами» IT-индустрии, каждый из которых может поделиться своей экспертизой; профессиональное развитие: прямо в офисе мы организуем митапы, конференции, встречи разработчиков и тестировщиков, семинары и тренинги, куда открыт доступ каждому сотруднику; новый опыт: лучшие сотрудники преподают в наших образовательных проектах, выступают на российских и международных конференциях; офис в 5 минутах от метро, крытый паркинг для всех сотрудников, велопарковка, а летом ― прокат велосипедов, лонгбордов и самокатов; здоровье и спорт: программа ДМС доступна с первого месяца работы; для поддержания иммунитета круглый год во фреш-баре овощи и фрукты; собственный тренажерный и спортивный зал в офисе. 





",Вакансия опубликована 5 октября 2021 в Москве,"['Lua', 'Linux', 'C++', 'Python']"
54,https://nn.hh.ru/vacancy/48530631?from=vacancy_search_list&query=lua,Дежурный преподаватель по программированию,от 25 000 руб. на руки,IT школа Hello world,True,Санкт-Петербург,"Частичная занятость, полный день",не требуется,Возможна подработка: сменами по 4-6 часов или по вечерам,False,"IT-школа HelloWorld – самая большая и быстрорастущая онлайн-школа в России. Главная ценность школы - Развитие, поэтому уже с момента собеседования мы непрерывно обучаем всех сотрудников. Мы обучаем ребят от 6 лет по следующим направлениям: -Компьютерная грамотность - Графический дизайн в редакторе Figma - Программирование на языке Scratch - Создание 3D игр в Roblox - Создание сайтов Front-end разработка - Программирование на языке Python - Программирование на языке С++ - Создание игр на Unity. Вы нам подходите, если: 1.Окончили или учитесь в IT, техническом или педагогическом ВУЗе; 2.Имеете опыт преподавания; 3.Получили дополнительное образование или прошли профессиональную переподготовку в сфере IT; 4.Готовы работать от 25 часов в неделю в вечернее время и в выходные дни. Что нужно делать:  Проводить занятия в онлайн-формате; Контролировать качество учебного процесса; Обеспечивать обратную связь родителям.  График работы: 6/1 по 4 часа в будни с 15.00 по 21.00 (мск) и выходные дни в любой период с 09.00 до 21.00 (мск). Есть возможностью расширить рабочее время. Смены на будние дни: 1. с 15.00 до 18.00 включительно (мск); 2. с 18.00 до 21.00 включительно (мск); Минимальная нагрузка в неделю 25 часов. Мы предлагаем:  Работу в большом и дружном коллективе; Методические материалы к урокам; Полностью официальное трудоустройство согласно ТК РФ; Возможность карьерного роста до наставника, куратора, методиста, руководителя направления; Обучение английскому с носителем языка; Программу повышения квалификации по softs skills и hard skills;  7. Скидки для детей сотрудников на обучение в нашей школе;",Вакансия опубликована 5 октября 2021 в Санкт-Петербурге,"['Unity', 'Figma', 'Python', 'C#', 'CSS', 'HTML', 'C++', 'Lua', 'roblox', 'scratch']"
55,https://nn.hh.ru/vacancy/48530705?from=vacancy_search_list&query=lua,Дежурный преподаватель по программированию,от 25 000 руб. на руки,IT школа Hello world,True,Киров (Кировская область),"Частичная занятость, полный день",не требуется,Возможна подработка: сменами по 4-6 часов или по вечерам,False,"IT-школа HelloWorld – самая большая и быстрорастущая онлайн-школа в России. Главная ценность школы - Развитие, поэтому уже с момента собеседования мы непрерывно обучаем всех сотрудников. Мы обучаем ребят от 6 лет по следующим направлениям: -Компьютерная грамотность - Графический дизайн в редакторе Figma - Программирование на языке Scratch - Создание 3D игр в Roblox - Создание сайтов Front-end разработка - Программирование на языке Python - Программирование на языке С++ - Создание игр на Unity. Вы нам подходите, если: 1.Окончили или учитесь в IT, техническом или педагогическом ВУЗе; 2.Имеете опыт преподавания; 3.Получили дополнительное образование или прошли профессиональную переподготовку в сфере IT; 4.Готовы работать от 25 часов в неделю в вечернее время и в выходные дни. Что нужно делать:  Проводить занятия в онлайн-формате; Контролировать качество учебного процесса; Обеспечивать обратную связь родителям.  График работы: 6/1 по 4 часа в будни с 15.00 по 21.00 (мск) и выходные дни в любой период с 09.00 до 21.00 (мск). Есть возможностью расширить рабочее время. Смены на будние дни: 1. с 15.00 до 18.00 включительно (мск); 2. с 18.00 до 21.00 включительно (мск); Минимальная нагрузка в неделю 25 часов. Мы предлагаем:  Работу в большом и дружном коллективе; Методические материалы к урокам; Полностью официальное трудоустройство согласно ТК РФ; Возможность карьерного роста до наставника, куратора, методиста, руководителя направления; Обучение английскому с носителем языка; Программу повышения квалификации по softs skills и hard skills;  7. Скидки для детей сотрудников на обучение в нашей школе;",Вакансия опубликована 5 октября 2021 в Кирове (Кировская область),"['Unity', 'Figma', 'Python', 'C#', 'CSS', 'HTML', 'C++', 'Lua', 'roblox', 'scratch']"
56,https://nn.hh.ru/vacancy/45992540?from=vacancy_search_list&query=lua,Senior Java разработчик (продукт X5.ID),з/п не указана,X5 RETAIL GROUP,True,"Парк культуры, Москва, улица Тимура Фрунзе, 11с13","Полная занятость, полный день",1–3 года,False,False,"
























В Дирекцию по разработке X5 Технологии открыта вакансия Java разработчика в продукт X5.ID. Наш продукт формирует единую учетную запись X5ID для всех приложений, сайтов, чат-ботов компании. Это позволяет формировать единый клиентский профиль для компании, обеспечить интеграцию программ лояльности всех торговых сетей, предоставить неограниченные возможности для подключения информационных систем внешних и внутренних партнеров, в том числе с обеспечением технологии единого входа Single Sign On. С точки зрения архитектуры мы создаем высоконагруженный продукт с постоянно увеличивающимся количеством подключаемых систем (как источников, так и потребителей данных), состоящий из нескольких микросервисов. При разработке используем следующие основные технологии: Java, Spring Boot, Kafka, Tarantool DataGrid, Docker, Kubernetes. Процессы CI / CD мы строим на базе корпоративного Gitlab и Artifactory. Качество кода постоянно контролируется с помощью Unit и интеграционных тестов, а также нагрузочного тестирования и тестирования безопасности. В нашей команде тебе предстоит:  Разработка программных модулей в микросервисном окружении; Участие в проработке архитектуры системы и принятии технических решений; Участие в настройке процессов CI/CD; Участие в процессах Code Review и тестирования; Оказание консультаций по техническим вопросам специалистам поддержки; Выявление дефектов и устранение причин их возникновения; Сопровождение и эксплуатация разрабатываемой системы; Работа в команде, ориентированной на качественный результат.  Мы ждем тебя, если ты имеешь:  Опыт коммерческой разработчик на Java от 2 лет; Знание Java Core 8 и выше; Знание и умение эффективно применять Spring Framework, Spring Boot; Опыт работы с очередями (Kafka / RabbitMQ / ActiveMQ); Опыт работы с микросервисами (Spring Boot, Docker, Kubernetes); Знание основных принципов написания кода и паттернов проектирования; Умение работать с Git.  Будет плюсом:  Опыт работы с высокими нагрузками; Опыт работы с Tarantool DataGrid, Apache Ignite либо иными платформами in-memory вычислений; Опыт промышленного применения Kafka; Знание синтаксиса и опыт применения языка Lua; Опыт разработки Pipelines в GitLab либо налаживания CI/CD процессов с применением других инструментов. Опыт управления небольшой командой разработки.  Мы предлагаем:  Удобный офис у м. Парк Культуры или удаленная работа; Гибкий график работы (с 8/9/10/11 утра); Возможность обучаться и сертифицироваться за счёт компании: внешние тренинги и семинары по профессиональным тематикам, отраслевые конференции, программа развития управленческих навыков, очные мастер-классы, платформы онлайн-образования и многое другое; Яркую корпоративную жизнь с большим количеством мероприятий, конкурсов и возможностей для творческой реализации; Развитую систему компенсаций и льгот; Широкий пакет ДМС (включая выезд за рубеж и стоматологию), страхование жизни и здоровья; Скидки в магазинах сети Х5 («Пятёрочка», «Перекрёсток», «Карусель»); Программу привилегий Prime-zone (скидки на товары и услуги и специальные предложения от компаний-партнёров); Материальную помощь сотрудникам, попавшим в сложную жизненную ситуацию; Оформление по ТК РФ с официальной заработной платой.  Присоединяйся к одной из самых быстрорастущих цифровых команд России! Узнай о нас больше в соц. сетях #X5TECH или в нашем инстаграм @Insider_X5





",Вакансия опубликована 29 сентября 2021 в Москве,"['Java', 'Spring Framework', 'SQL']"
57,https://nn.hh.ru/vacancy/48353530?from=vacancy_search_list&query=lua,Инженер - программист по бизнес-системам,з/п не указана,Nexign (АО «Нэксайн»),True,Самара,"Полная занятость, полный день",1–3 года,False,False,"






Nexign (ранее «Петер-Сервис») — разработчик инновационных IT-решений для телекоммуникационной отрасли


Обязанности:  Решение текущих проблем и аварийных ситуаций у клиентов, реализация исправлений; Консультирование клиентов по вопросам конфигурирования и использования установленных решений; Внедрение новых функциональных возможностей у клиентов.  Обязательные требования:  SQL - уверенное владение; Pl/SQL - уверенное владение; Oracle - наличие опыта работы; Навыки деловых коммуникаций, способность грамотно излагать свои мысли в устной и письменной форме; Готовность к дежурствам в режиме 24*7 (в среднем 6 дежурств в месяц).  Будет плюсом:  Опыт работы с Linux; Опыт работы с apache, nginx; Навыки оптимизации сложных sql запросов и решения проблем производительности, опыт работы с высоконагруженными системами; Опыт в разработке или тестировании; Готовность к редким командировкам; Навыки программирования на языках высокого уровня – С++, Java, Lua, Python, уметь понимать код.  Условия:  приходить в комфортный офис, где есть кухни с фруктами, кофе и печеньками, спортивный зал с душем и зона отдыха с PS4, настольными играми и массажным креслом; пятидневка, возможность удаленной работы; иметь возможность работать на мощных современных ПК; постоянно развиваться: участвовать в конференциях и митапах, прокачивать hard и soft skills в Nexign Academy; участвовать в спортивных мероприятиях под флагом Nexign; совершенствовать английский язык за счет компании; заботиться о здоровье: у нас есть ДМС со стоматологией, страхование от несчастных случаев, полис для выезжающих за рубеж; пользоваться программой «Кафетерий»: сотрудники за счет компании могут компенсировать расходы на отпуск, обучение, покупку билетов и абонементов на культурные и спортивные мероприятия, снаряжение для туризма и активного отдыха. 


",Вакансия опубликована 29 сентября 2021 в Самаре,"['Грамотная речь', 'Работа в команде', 'Английский язык', 'Грамотность', 'Деловая коммуникация']"
